Sheet: Calculations
A2: Edge | B2: OWASP | C2: Acunetix
A3: Command injection | B3: of:=[$OWASP.D4] -> 15.1600782807901 | C3: of:=[$Acunetix.H2] -> 25.4582168482974
A4: Brute force (login form) | B4: ? | C4: of:=[$Acunetix.H16] -> 19.9163170128991
A5: Cross Site Request Forgery | B5: of:=[$OWASP.D7] -> 94.1853899152422
A6: Hanging the script (self-inclusion)
A7: File inclusion (remote PHP script injection)
A8: File inclusion (local PHP script injection)
A9: File inclusion (path traversal)
A10: File upload (PHP script)
A11: File upload (DDOS)
A12: SQL injection
A13: Brute force (on the database)
A14: Credentials change in the database
A15: SQL shellcode
A16: Root → Machine
A17: Weak session ID
A18: DOM Cross Site Scripting
A19: Reflected Cross Site Scripting
A20: Exposed config

Sheet: OWASP
A1: Vulnerability type | B1: Instances | C1: of all | D1: Score
A2: SQL Injection Vulnerabilities (CWE-89) | B2: 182810 | C2: of:=[.B2]/[.$B$34] -> 0.0794101038182529 | D2: of:=[.C2]^(1/3)*100 -> 42.9825246851838
A3: Hibernate Injection Vulnerabilities (CWE-564) | B3: 2068 | C3: of:=[.B3]/[.$B$34] -> 0.000898310238477911 | D3: of:=[.C3]^(1/3)*100 -> 9.64884766494825
A4: Command Injection Vulnerabilities (CWE-77) | B4: 8021 | C4: of:=[.B4]/[.$B$34] -> 0.00348421006906737 | D4: of:=[.C4]^(1/3)*100 -> 15.1600782807901
A5: Authentication Vulnerabilities (CWE-287) | B5: 4563 | C5: of:=[.B5]/[.$B$34] -> 0.00198210329698971 | D5: of:=[.C5]^(1/3)*100 -> 12.561517121764
A6: Session Fixation Vulnerabilities (CWE-384) | B6: 4861 | C6: of:=[.B6]/[.$B$34] -> 0.00211155032361757 | D6: of:=[.C6]^(1/3)*100 -> 12.829226679319
A7: Cross-Site Scripting (XSS) Vulnerabilities (CWE-79) | B7: 1923423 | C7: of:=[.B7]/[.$B$34] -> 0.835508014421615 | D7: of:=[.C7]^(1/3)*100 -> 94.1853899152422
A8: DOM-Based XSS Vulnerabilities (No CWE) | B8: 216 | C8: of:=[.B8]/[.$B$34] -> 0.0000938273750054298 | D8: of:=[.C8]^(1/3)*100 -> 4.54405091366183
A9: Insecure Direct Object Reference Vulnerabilities (CWE-639) | B9: 4235 | C9: of:=[.B9]/[.$B$34] -> 0.00183962469049998 | D9: of:=[.C9]^(1/3)*100 -> 12.253018144017
A10: Path Traversal Vulnerabilities (CWE-22) | B10: 12382 | C10: of:=[.B10]/[.$B$34] -> 0.00537856739498719 | D10: of:=[.C10]^(1/3)*100 -> 17.5208647951791
A11: Missing Authorization Vulnerabilities (CWE-285) | B11: 3295 | C11: of:=[.B11]/[.$B$34] -> 0.0014313018548282 | D11: of:=[.C11]^(1/3)*100 -> 11.2696495570556
A12: Security Misconfiguration Vulnerabilities (CWE-2) | B12: 11841 | C12: of:=[.B12]/[.$B$34] -> 0.00514356457147822 | D12: of:=[.C12]^(1/3)*100 -> 17.2618788965383
A13: Cleartext Transmission of Sensitive Information Vulnerabilities (CWE-319) | B13: 2341 | C13: of:=[.B13]/[.$B$34] -> 0.00101689761522089 | D13: of:=[.C13]^(1/3)*100 -> 10.0560110742913
A14: Cleartext Storage of Sensitive Information Vulnerabilities (CWE-312) | B14: 1293 | C14: of:=[.B14]/[.$B$34] -> 0.000561661092046392 | D14: of:=[.C14]^(1/3)*100 -> 8.25071235744875
A15: Cryptographic Vulnerabilities (CWEs-310/326/327/etc) | B15: 9692 | C15: of:=[.B15]/[.$B$34] -> 0.00421006906737327 | D15: of:=[.C15]^(1/3)*100 -> 16.1471696003414
A16: Improper (Function Level) Access Control Vulnerabilities (CWE-285) | B16: 600 | C16: of:=[.B16]/[.$B$34] -> 0.000260631597237305 | D16: of:=[.C16]^(1/3)*100 -> 6.38766828896107
A17: Cross-Site Request Forgery (CSRF) Vulnerabilities (CWE-352) | B17: 1310 | C17: of:=[.B17]/[.$B$34] -> 0.000569045653968116 | D17: of:=[.C17]^(1/3)*100 -> 8.28671438173211
A18: Use of Known Libraries (NEW 937) | B18: 3353 | C18: of:=[.B18]/[.$B$34] -> 0.00145649624256114 | D18: of:=[.C18]^(1/3)*100 -> 11.3353897219279
A19: Unchecked Redirect Vulnerabilities (CWE-601) | B19: 57177 | C19: of:=[.B19]/[.$B$34] -> 0.024836888058729 | D19: of:=[.C19]^(1/3)*100 -> 29.176446281852
A20: Unvalidated Forward Vulnerabilities (No CWE) | B20: 831 | C20: of:=[.B20]/[.$B$34] -> 0.000360974762173667 | D20: of:=[.C20]^(1/3)*100 -> 7.12020142466126
A21: Clickjacking Vulnerabilities (No CWE) | B21: 4144 | C21: of:=[.B21]/[.$B$34] -> 0.00180009556491899 | D21: of:=[.C21]^(1/3)*100 -> 12.1646192633153
A22: XML eXternal Entity Injection (XXE) Vulnerabilities (CWE-611) | B22: 42337 | C22: of:=[.B22]/[.$B$34] -> 0.0183905998870596 | D22: of:=[.C22]^(1/3)*100 -> 26.3956259430763
A23: Server-Side Request Forgery (SSRF) Vulnerabilities (CWE-918) | B23: 195 | C23: of:=[.B23]/[.$B$34] -> 0.0000847052691021242 | D23: of:=[.C23]^(1/3)*100 -> 4.39174189867356
A24: Denial of Service (DOS) Vulnerabilities (CWE-400) | B24: 1452 | C24: of:=[.B24]/[.$B$34] -> 0.000630728465314278 | D24: of:=[.C24]^(1/3)*100 -> 8.5759217659589
A25: Expression Language Injection Vulnerabilities (CWE-917) | B25: 6 | C25: of:=[.B25]/[.$B$34] -> 0.00000260631597237305 | D25: of:=[.C25]^(1/3)*100 -> 1.37618141501543
A26: Error Handling Vulnerabilities (CWE-388) | B26: 4052 | C26: of:=[.B26]/[.$B$34] -> 0.0017601320533426 | D26: of:=[.C26]^(1/3)*100 -> 12.0739234285574
A27: Information Leakage/Disclosure Vulnerabilities (CWE-200) | B27: 4109 | C27: of:=[.B27]/[.$B$34] -> 0.00178489205508014 | D27: of:=[.C27]^(1/3)*100 -> 12.1302751526528
A28: Insufficient Anti-automation Vulnerabilities (CWE-799) | B28: 732 | C28: of:=[.B28]/[.$B$34] -> 0.000317970548629512 | D28: of:=[.C28]^(1/3)*100 -> 6.82541347308411
A29: Insufficient Security Logging Vulnerabilities (CWE-778) | B29: 990 | C29: of:=[.B29]/[.$B$34] -> 0.000430042135441553 | D29: of:=[.C29]^(1/3)*100 -> 7.54808884241265
A30: Insufficient Intrusion Detection and Response Vulnerabilities (No CWE) | B30: 0 | C30: of:=[.B30]/[.$B$34] -> 0 | D30: of:=[.C30]^(1/3)*100 -> 0
A31: Mass Assignment Vulnerabilities (CWE-915) | B31: 5058 | C31: of:=[.B31]/[.$B$34] -> 0.00219712436471048 | D31: of:=[.C31]^(1/3)*100 -> 13.0002452906587
A32: Input Validation | B32: 4699 | C32: of:=[.B32]/[.$B$34] -> 0.00204117979236349 | D32: of:=[.C32]^(1/3)*100 -> 12.6850958571286
A33: Unrestricted Upload of File with Dangerous Type (CWE-434) | B33: 14 | C33: of:=[.B33]/[.$B$34] -> 0.00000608140393553712 | D33: of:=[.C33]^(1/3)*100 -> 1.82530152626341
B34: of:=SUM([.B2:.B33]) -> 2302100

Sheet: Acunetix
A1: Vulnerability category | B1: Subcategory | C1: # in subcat. | D1: % of targets | E1: # in category | F1: % of targets | H1: Category score
A2: Remote Code Execution | B2: Remote Code Execution | C2: 165 | D2: of:=[.C2]/10000 -> 0.0165 | E2: 165 | F2: of:=[.E2]/10000 -> 0.0165 | H2: of:=[.F2]^(1/3)*100 -> 25.4582168482974
A3: SQL Injection (SQLi) | B3: SQL Injection (SQLi) | C3: 1328 | D3: of:=[.C3]/10000 -> 0.1328 | E3: of:=SUM([.C3:.C5]) -> 2656 | F3: of:=SUM([.D3:.D5]) -> 0.2656 | H3: of:=[.F3]^(1/3)*100 -> 64.2800230117402
B4: BLIND SQLI | C4: 776 | D4: of:=[.C4]/10000 -> 0.0776 | H4: of:=[.F4]^(1/3)*100 -> 0
B5: UNION/EROR SQLI | C5: 552 | D5: of:=[.C5]/10000 -> 0.0552 | H5: of:=[.F5]^(1/3)*100 -> 0
A6: Local File Inclusion & Directory Traversal | B6: Local File Inclusion | C6: 79 | D6: of:=[.C6]/10000 -> 0.0079 | E6: of:=SUM([.C6:.C8]) -> 434 | F6: of:=SUM([.D6:.D8]) -> 0.0434 | H6: of:=[.F6]^(1/3)*100 -> 35.142277986987
B7: Directory Traversal | C7: 138 | D7: of:=[.C7]/10000 -> 0.0138 | E7: of:=SUM([.C7:.C9]) -> 408
B8: Both | C8: 217 | D8: of:=[.C8]/10000 -> 0.0217 | E8: of:=SUM([.C8:.C10]) -> 3184
A9: XSS | B9: Dom-Based XSS | C9: 53 | D9: of:=[.C9]/10000 -> 0.0053 | E9: of:=SUM([.C9:.C10]) -> 2967 | F9: of:=SUM([.D9:.D10]) -> 0.2967 | H9: of:=[.F9]^(1/3)*100 -> 66.6969307036865
B10: XSS | C10: 2914 | D10: of:=[.C10]/10000 -> 0.2914
A11: JS library vulnerabilities | B11: JQUERY | C11: 2407 | D11: of:=[.C11]/10000 -> 0.2407 | E11: of:=SUM([.C11:.C15]) -> 3265 | F11: of:=SUM([.D11:.D15]) -> 0.3265 | H11: of:=[.F11]^(1/3)*100 -> 68.8590555678771
B12: JQUERY MIGRATE | C12: 101 | D12: of:=[.C12]/10000 -> 0.0101
B13: YUI | C13: 65 | D13: of:=[.C13]/10000 -> 0.0065
B14: MOMENT.JS | C14: 72 | D14: of:=[.C14]/10000 -> 0.0072
B15: JQUERY UI | C15: 620 | D15: of:=[.C15]/10000 -> 0.062
A16: Weak Passwords | B16: Weak Passwords | C16: 79 | D16: of:=[.C16]/10000 -> 0.0079 | E16: 79 | F16: of:=[.E16]/10000 -> 0.0079 | H16: of:=[.F16]^(1/3)*100 -> 19.9163170128991
A17: Source Code Disclosure | B17: Source Code Disclosure | C17: 395 | D17: of:=[.C17]/10000 -> 0.0395 | E17: 395 | F17: of:=[.E17]/10000 -> 0.0395 | H17: of:=[.F17]^(1/3)*100 -> 34.0564230384454
A18: Server-side Request Forgery | B18: Server-side Request Forgery | C18: 70 | D18: of:=[.C18]/10000 -> 0.007 | E18: 70 | F18: of:=[.E18]/10000 -> 0.007 | H18: of:=[.F18]^(1/3)*100 -> 19.1293118277239
A19: Overflow Vulnerabilities | B19: Overflow Vulnerabilities | C19: 475 | D19: of:=[.C19]/10000 -> 0.0475 | E19: 475 | F19: of:=[.E19]/10000 -> 0.0475 | H19: of:=[.F19]^(1/3)*100 -> 36.2157822172087
A20: Network Vulnerabilities | B20: SSH-related vulnerabilities | C20: ~1900 | D20: 0.19 | E20: High: ~1600 Medium ~3500 | F20: High: 16% Medium: 35% | H20: of:=((0.35*2+0.16)/3)^(1/3)*100 -> 65.9364759667164
B21: FTP-related vulnerabilities | C21: ~600 | D21: 0.06
B22: Mail-related vulnerabilities | C22: ~20 | D22: 0.02
B23: DNS-related vulnerabilities | C23: ~20 | D23: 0.02
A24: DoS | B24: Slow HTTP DoS | C24: 1211 | D24: of:=[.C24]/10000 -> 0.1211 | E24: of:=SUM([.C24:.C25]) -> 2905 | F24: of:=SUM([.D24:.D25]) -> 0.2905 | H24: of:=[.F24]^(1/3)*100 -> 66.2290784774101
B25: DoS | C25: 1694 | D25: of:=[.C25]/10000 -> 0.1694
A26: Cross-site Request Forgery | B26: Cross-site Request Forgery | C26: 4674 | D26: of:=[.C26]/10000 -> 0.4674 | E26: 4674 | F26: of:=[.E26]/10000 -> 0.4674 | H26: of:=[.F26]^(1/3)*100 -> 77.6061673633012
A27: Host Header Injection | B27: Host Header Injection | C27: 396 | D27: of:=[.C27]/10000 -> 0.0396 | E27: 396 | F27: of:=[.E27]/10000 -> 0.0396 | H27: of:=[.F27]^(1/3)*100 -> 34.0851384171747
A28: Directory Listing | B28: Directory Listing | C28: 795 | D28: of:=[.C28]/10000 -> 0.0795 | E28: 795 | F28: of:=[.E28]/10000 -> 0.0795 | H28: of:=[.F28]^(1/3)*100 -> 42.9987380195705
A29: TLS/SSL Vulnerabilities | B29: BREACH | C29: 595 | D29: of:=[.C29]/10000 -> 0.0595 | E29: ~1700 | F29: 0.17 | H29: of:=[.F29]^(1/3)*100 -> 55.3965825675447
B30: DROWN | C30: 57 | D30: of:=[.C30]/10000 -> 0.0057
B31: POODLE | C31: 306 | D31: of:=[.C31]/10000 -> 0.0306
B32: HEARTBLEED | C32: 2 | D32: of:=[.C32]/10000 -> 0.0002
A33: Web Server Vulnerabilities & Misconfigurations | B33: Apache | C33: 749 | D33: of:=[.C33]/10000 -> 0.0749 | E33: of:=SUM([.C33:.C35]) -> 4285 | F33: of:=SUM([.D33:.D35]) -> 0.4285 | H33: of:=[.F33]^(1/3)*100 -> 75.3905552832988
B34: IIS | C34: 2097 | D34: of:=[.C34]/10000 -> 0.2097
B35: NGINX | C35: 1439 | D35: of:=[.C35]/10000 -> 0.1439