Sheet: Large Responses
A1: Timestamp | B1: Name of Company/Organization | C1: Company/Organization Web Site | D1: Point of Contact Name | E1: Point of Contact E-Mail | F1: During what year(s) was this data collected? | G1: If the application vulnerability data you are submitting was extracted from a publicly available report, please provide a link to that report (or reports), and the relevant page number(s) | H1: How many web applications do the submitted results cover? | I1: What were the primary programming languages the applications you reviewed written in? | J1: Please supply the exact percentage of applications per language checked off above: | K1: What were the primary industries these applications supported? | L1: Where in the world were the application owners primarily? | M1: What type of team did the bulk of this work? | N1: What type of analysis tools do they use? | O1: Which analysis tools do you frequently use? | P1: What is your primary assessment methodology? | Q1: Number of SQL Injection Vulnerabilities Found (CWE-89)? | R1: Number of Hibernate Injection Vulnerabilities Found (CWE-564)? | S1: Number of Command Injection Vulnerabilities Found (CWE-77)? | T1: Number of Authentication Vulnerabilities Found (CWE-287)? | U1: Number of Session Fixation Vulnerabilities Found (CWE-384)? | V1: Number of Cross-Site Scripting (XSS) Vulnerabilities Found (CWE-79)? | W1: Number of DOM-Based XSS Vulnerabilities Found (No CWE)? | X1: Number of Insecure Direct Object Reference Vulnerabilities Found (CWE-639)? | Y1: Number of Path Traversal Vulnerabilities Found (CWE-22)? | Z1: Number of Missing Authorization Vulnerabilities Found (CWE-285)? | AA1: Number of Security Misconfiguration Vulnerabilities Found (CWE-2)? | AB1: Number of Cleartext Transmission of Sensitive Information Vulnerabilities Found (CWE-319)? | AC1: Number of Cleartext Storage of Sensitive Information Vulnerabilities Found (CWE-312)? | AD1: Number of Cryptographic Vulnerabilities Found (CWEs-310/326/327/etc)? | AE1: Number of Improper (Function Level) Access Control Vulnerabilities Found (CWE-285)? | AF1: Number of Cross-Site Request Forgery (CSRF) Vulnerabilities Found (CWE-352)? | AG1: Number of Use of Known Libraries Found (NEW 937)? | AH1: Number of Unchecked Redirect Vulnerabilities Found (CWE-601)? | AI1: Number of Unvalidated Forward Vulnerabilities Found (No CWE)? | AJ1: Number of Clickjacking Vulnerabilities Found (No CWE)? | AK1: Number of XML eXternal Entity Injection (XXE) Vulnerabilities Found (CWE-611)? | AL1: Number of Server-Side Request Forgery (SSRF) Vulnerabilities Found (CWE-918)? | AM1: Number of Denial of Service (DOS) Vulnerabilities Found (CWE-400)? | AN1: Number of Expression Language Injection Vulnerabilities Found (CWE-917)? | AO1: Number of Error Handling Vulnerabilities Found (CWE-388)? | AP1: Number of Information Leakage/Disclosure Vulnerabilities Found (CWE-200)? | AQ1: Number of Insufficient Anti-automation Vulnerabilities Found (CWE-799)? | AR1: Number of Insufficient Security Logging Vulnerabilities Found (CWE-778)? | AS1: Number of Insufficient Intrusion Detection and Response Vulnerabilities Found (No CWE)? | AT1: Number of Mass Assignment Vulnerabilities Found (CWE-915)? | AU1: Input Validation | AV1: Unrestricted Upload of File with Dangerous Type (CWE-434) | AW1: What other vulnerabilities did you find? | AX1: Vulnerability types you think should be added to the T10? | AY1: Vulnerability types you think should be removed from the T10? | AZ1: Suggested changes to the Top 10 Document/Wiki? | BA1: Suggestions on how to improve this call for data?
A2: 2016-05-31T11:14:46.99 | B2: edgescan | D2: Eoin Keary | E2: eoin@edgescan.com | F2: Both 2014 & 2015 | H2: 356 | I2: Java, .NET, PHP | J2: Java = 45%. .Net = 45% PHP=10% | K2: Financial, Healthcare, eCommerce, Energy, Government, Gaming | L2: North America, Europe, Middle East | M2: Consulting Organization | N2: Free/Open Source Dynamic Application Security Testing (DAST) Tools, Commercial Dynamic Application Security Testing (DAST) Tools, edgescan bespoke engine | O2: edgescan, Burp, Acunetix, OWASP Zap | P2: Output from manually tailored automated analysis tool(s) - with manual false positive analysis/elimination | Q2: 27 | R2: 0 | S2: 22 | T2: 21 | U2: 20 | V2: 1023 | W2: 76 | X2: 56 | Y2: 33 | Z2: 24 | AA2: 418 | AB2: 114 | AC2: 0 | AD2: 655 | AE2: 0 | AF2: 82 | AG2: 602 | AH2: 22 | AI2: 0 | AJ2: 826 | AK2: 30 | AL2: 3 | AM2: 374 | AN2: 4 | AO2: 136 | AP2: 136 | AQ2: 23 | AR2: 0 | AS2: 0 | AT2: 12 | AW2: XML Injection - 23 Exposed Admin Interface: 11 | AX2: SSL/HTTPS as a specific Topic? | AY2: Security Misconfiguration - Change to "Poor maintenance / insecure deployment" | AZ2: None, its great | BA2: None its also a great start
A3: 2016-07-15T14:55:28.301 | B3: Veracode | C3: https://www.veracode.com/ | D3: Tim Jarrett | E3: tjarrett@veracode.com | F3: 2015 | H3: 44627 | I3: Java, .NET, PHP | J3: Java - 53.4%, .NET - 33.1%, PHP - 5.4% | K3: Financial, eCommerce, Internet/Social Media, Commercial software, telecommunications, manufacturing, education | M3: Product Vendor/Service Provider (e.g., SaaS) | N3: Commercial Static Application Security Testing (SAST) Tools, Commercial Dynamic Application Security Testing (DAST) Tools | O3: Veracode Static Analysis, Veracode DynamicDS, Veracode DynamicMP | P3: Raw output of automated analysis tools, using rules tuned by earlier stage manual false positive analysis | Q3: 173883 | R3: 1993 | S3: 7673 | T3: 30 | U3: 2973 | V3: 1903322 | X3: 100 | Y3: 8573 | AC3: 113 | AF3: 43 | AH3: 56503 | AK3: 41849 | AT3: 4915 | AW3: via email | AX3: CWE 611 -- almost as many applications affected as CWE 89, also bears info disclosure risk (if application is deployed in the cloud). | AZ3: More transparent documentation of data collection methodology from contributors. For instance, Veracode's statement would be: collected from applications on their first scan by a particular SAAS vendor, excluding results from languages written in primarily non-web languages (ObjectiveC, Swift, C/C++, VB6) | BA3: Shift from # of vulnerabilities found (vulnerability prevalence) to number of applications affected (app prevalence), or reporting both. Vulnerability prevalence gives you an idea of developer effort to fix; arguably app prevalence gives you an idea of the enterprise risk.
A4: 2016-07-18T16:48:39.29 | B4: Branding Brand | C4: www.brandingbrand.com | D4: Alex Cline | E4: alex.cline@brandingbrand.com | F4: Both 2014 & 2015 | H4: 200 | I4: Java, PHP, Node.js, Objective-C | J4: Node.js - 80%, PHP 10%, Java 5%, Objective-C 5% | K4: eCommerce | L4: North America | M4: Internal Assessment Team(s) | N4: Free/Open Source Static Application Security Testing (SAST) Tools, Free/Open Source Dynamic Application Security Testing (DAST) Tools, Commercial Static Application Security Testing (SAST) Tools, Commercial Dynamic Application Security Testing (DAST) Tools | O4: Nessus, Checkmarx, Bespoke Analysis, HackerGuardian | P4: Combined manual expert code review and penetration testing with only commercial tools | Q4: 9 | R4: 0 | S4: 2 | T4: 124 | U4: 76 | V4: 681 | W4: 19 | X4: 6 | Y4: 22 | Z4: 7 | AA4: 14 | AB4: 149 | AC4: 0 | AD4: 102 | AE4: 69 | AF4: 183 | AG4: 55 | AH4: 26 | AI4: 33 | AJ4: 182 | AL4: 1 | AM4: 27 | AO4: 8 | AP4: 49 | AW4: Cross Site History Manipulation, 203, 6 Client Insecure Randomness, 330, 29 Privacy Violation, 359, 11 HTML/Cookie Injection, 94, 433 Remote File Inclusion, 829, 23 Regex Injection, 624, 10 | AX4: Explicitly calling out Regular Expression Injection and DoS vulnerabilities.
A5: 2016-07-19T10:14:54.112 | B5: Paladion Networks | C5: www.paladion.net | D5: Prashant Verma | E5: prashant.verma@paladion.net | F5: Both 2014 & 2015 | G5: NA | H5: 1400 | I5: Java, .NET, PHP | J5: Java 70%, .NET 10%, PHP 12% | K5: Financial, eCommerce, Internet/Social Media, Government | L5: North America, AsiaPac, Middle East | M5: Consulting Organization | N5: Commercial Static Application Security Testing (SAST) Tools, Commercial Dynamic Application Security Testing (DAST) Tools | O5: Burp Suite Pro, NetSparker | P5: Manual expert penetration testing with commercial DAST tool(s) | Q5: 780 | R5: 0 | S5: 14 | T5: 400 | U5: 780 | V5: 1040 | W5: 15 | X5: 530 | Y5: 130 | Z5: 1100 | AA5: 400 | AB5: 1020 | AC5: 170 | AD5: 35 | AE5: 304 | AF5: 437 | AG5: 40 | AH5: 50 | AI5: 48 | AJ5: 900 | AK5: 200 | AL5: 0 | AM5: 800 | AN5: 0 | AO5: 1200 | AP5: 400 | AQ5: 520 | AR5: 364 | AS5: 0 | AT5: 20 | AX5: SQL Injection and Other Injection attacks can be separated. 95% of our discovered injection attacks are SQL Injection. Similarly Broken Authentication & Session Management can be separated into two different categories. | AY5: "Using components with known vulnerabilities" can be a subset of "Security Misconfiguration" as patched components are not used. | AZ5: If CWEs can be listed down against each Top 10 that will be of great help to pentesters. | BA5: Bifurcation of automated and manual pentest vulnerability count is important to arrive at real weightage to each of Top10. If data call format is available in a year advance, then more detailed data can be recorded and submitted.
A6: 2016-07-19T22:19:29.467 | B6: Vantage Point | C6: www.vantagepoint.sg | D6: Gerhard Wagner | E6: gerhard@vantagepoint.sg | F6: 2015 | G6: http://www.vantagepoint.sg/blog/69-owasp-top-10-data-call-submission | H6: 111 | I6: Java, .NET, PHP | K6: Financial, eCommerce, Internet/Social Media, Entertainment (Games/Music/Movies), Government | L6: AsiaPac | M6: Consulting Organization | N6: Free/Open Source Static Application Security Testing (SAST) Tools, Free/Open Source Dynamic Application Security Testing (DAST) Tools, Commercial Static Application Security Testing (SAST) Tools, Commercial Dynamic Application Security Testing (DAST) Tools | P6: manual expert penetration testing or/and code review coupled with commercial as well as free DAST and SAST tools | Q6: 50 | R6: 0 | S6: 6 | T6: 70 | U6: 1 | V6: of:=145+80 -> 225 | W6: 0 | X6: 104 | Y6: 20 | Z6: 76 | AA6: 0 | AB6: 22 | AC6: 15 | AD6: 5 | AE6: 0 | AF6: 10 | AG6: 130 | AH6: 0 | AI6: 0 | AJ6: 0 | AK6: 2 | AL6: 0 | AM6: 0 | AN6: 0 | AO6: 0 | AP6: 75 | AQ6: 14 | AV6: 14 | AX6: CWE-434: Unrestricted Upload of File with Dangerous Type
A7: 2016-07-20T14:19:00.009 | B7: iBLISS Segurança & Inteligência | C7: www.ibliss.com.br | D7: Bruno Freire | E7: bruno.freire@ibliss.com.br | F7: Both 2014 & 2015 | H7: 148 | I7: Java, .NET, PHP | J7: 56% Java, 33% .Net, 11% PHP | K7: Financial, Healthcare, eCommerce, Internet/Social Media, Entertainment (Games/Music/Movies), Government, Defense | L7: South America | M7: Internal Assessment Team(s) | N7: Free/Open Source Static Application Security Testing (SAST) Tools, Free/Open Source Dynamic Application Security Testing (DAST) Tools, Free/Open Source Interactive Application Security Testing (IAST) Tools, Commercial Dynamic Application Security Testing (DAST) Tools | O7: OWASP ZAP, Acunetix, Burp, mantra | P7: Output from manually tailored automated analysis tool(s) - with manual false positive analysis/elimination | Q7: 17 | R7: 0 | S7: 1 | U7: 111 | V7: 47 | W7: 2 | X7: 5 | Y7: 29 | Z7: 157 | AA7: 99 | AB7: 115 | AC7: 1 | AD7: 111 | AE7: 157 | AF7: 12 | AG7: 0 | AH7: 8 | AJ7: 14 | AK7: 0 | AL7: 0 | AM7: 2 | AN7: 0 | AO7: 137 | AP7: 30 | AQ7: 83 | AS7: 0 | AT7: 6 | AW7: 0
A8: 2016-07-20T17:06:27.716 | B8: AsTech Consulting | C8: https://www.astechconsulting.com | D8: Jason White | E8: jason.white@owasp.org | F8: Both 2014 & 2015 | H8: 54 | I8: Java, .NET | J8: Java - 54%, .Net-24% | K8: Financial, Healthcare | L8: North America | M8: Consulting Organization | N8: Commercial Static Application Security Testing (SAST) Tools, Commercial Dynamic Application Security Testing (DAST) Tools | P8: Manual expert code review with commercial SAST tool(s) | Q8: 371 | R8: 0 | S8: 1 | T8: of:=176+64+131 -> 371 | U8: of:=9+57+9 -> 75 | V8: 2012 | W8: 0 | X8: 0 | Y8: 175 | Z8: 3 | AA8: of:=67+353 -> 420 | AB8: 0 | AC8: of:=164+156 -> 320 | AD8: of:=195+15+46 -> 256 | AE8: 3 | AF8: 164 | AG8: 0 | AH8: 6 | AI8: 0 | AJ8: 0 | AK8: 0 | AL8: 0 | AM8: 0 | AN8: 0 | AO8: 1477 | AP8: of:=308+48+1+658 -> 1015 | AQ8: of:=17 -> 17 | AR8: 71 | AS8: 0 | AT8: 0 | AU8: of:=4676+23 -> 4699 | AZ8: The difficulty with Top 10 is the density and categorization. When unpacked, there are many more than 10 items and some can be cross-categorized. Highlighted somewhat in this post: https://www.astechconsulting.com/blog/2016/whats-in-a-name/ Also, maybe include risk as part of the top 10 data collection. However, that is likely to run into similar subjectivity problems as the labeling | BA8: Will think this over some more and send thoughts along directly via email
A9: 2016-07-22T12:38:49.502 | B9: Contrast Security | C9: http://contrastsecurity.com | D9: Jeff Williams | E9: jeff.williams@contrastsecurity.com | F9: 2015 | G9: Data is from a random sample of client applications using Contrast Enterprise SAAS edition only (not Contrast On-Premise edition) | H9: 3734 | I9: Java, .NET, Node.js | J9: 67% Java, 28% .NET, 5% Node.js | K9: Financial, Healthcare, eCommerce, Entertainment (Games/Music/Movies), Government | L9: North America, Europe, AsiaPac | M9: Product Vendor/Service Provider (e.g., SaaS) | N9: Commercial Interactive Application Security Testing (IAST) Tools | O9: Contrast Enterprise Edition | P9: Raw (untriaged) output of automated analysis tool results using default rules | Q9: 7506 | R9: 75 | S9: 196 | T9: 3196 | U9: 558 | V9: 13846 | W9: 6 | X9: 3250 | Y9: 2946 | Z9: 1684 | AA9: 9453 | AB9: 640 | AC9: 594 | AD9: 7459 | AE9: 67 | AF9: 75 | AG9: 2425 | AH9: 385 | AI9: 750 | AJ9: 1826 | AK9: 191 | AL9: 191 | AN9: 2 | AO9: 568 | AP9: 1422 | AQ9: 75 | AR9: 493 | AT9: 105 | AX9: Lack of attack detection/prevention, unprotected APIs, XXE, untrusted deserialization, use of non-standard controls, weak HTTP headers | AZ9: It's perfect the way it is | BA9: OWASP should redo the CWE correctly
A10: 2016-08-31T12:39:04.955 | B10: Minded Security | C10: https://www.mindedsecurity.com/ | D10: Gianrico | E10: gianrico.ingrosso@mindedsecurity.com | F10: Both 2014 & 2015 | H10: 110 | I10: Java, .NET, PHP | L10: North America, Europe | M10: Consulting Organization | N10: Free/Open Source Static Application Security Testing (SAST) Tools, Free/Open Source Dynamic Application Security Testing (DAST) Tools, Commercial Dynamic Application Security Testing (DAST) Tools | P10: Combined manual expert code review and penetration testing with only free tools | Q10: 154 | S10: 8 | T10: 102 | U10: 110 | V10: 1080 | W10: 98 | X10: 184 | Y10: 164 | Z10: 100 | AA10: 1010 | AB10: 194 | AC10: 60 | AD10: 971 | AF10: 243 | AG10: 101 | AH10: 172 | AJ10: 396 | AK10: 65 | AM10: 224 | AO10: 478 | AP10: 982 | AW10: User enumeration, CWE 203, 158 HTTP Response splitting, CWE 113, 62 Insecure session cookie, CWE 614, 316 Weak Password policy, CWE 521, 84 Arbitrary file upload, CWE 434, 188 No Session timeout, CWE 613, 65 LDAP injection, CWE 90, 57 View state MAC disabled, No CWE, 60 Insecure logout, No CWE, 55 Concurrent sessions permitted, No CWE, 102 Incorrect Content-Type in JSON responses, No CWE, 70
B11: Aspect Security | F11: Both 2014 & 2015 | H11: 155 | I11: Java, .NET | J11: ?? | L11: North America, Europe | M11: Consulting Organization | O11: Burp Pro | P11: manual expert penetration testing or/and code review coupled with commercial as well as free DAST and SAST tools | Q11: 13 | S11: 98 | T11: of:=219+30 -> 249 | U11: 157 | V11: 147 | Y11: 290 | Z11: of:=67+77 -> 144 | AA11: 27 | AB11: 87 | AC11: 20 | AD11: 98 | AF11: 61 | AH11: 5 | AM11: 25 | AO11: 48 | AR11: of:=60+2 -> 62
B13: of:=[.B2] -> edgescan | O13: of:=[.B2] -> edgescan | P13: Tools with manual false positive elimination | Q13: of:=[.Q2]/[.$H2] -> 0.0758426966292135 | R13: of:=[.R2]/[.$H2] -> 0 | S13: of:=[.S2]/[.$H2] -> 0.0617977528089888 | T13: of:=[.T2]/[.$H2] -> 0.0589887640449438 | U13: of:=[.U2]/[.$H2] -> 0.0561797752808989 | V13: of:=[.V2]/[.$H2] -> 2.87359550561798 | W13: of:=[.W2]/[.$H2] -> 0.213483146067416 | X13: of:=[.X2]/[.$H2] -> 0.157303370786517 | Y13: of:=[.Y2]/[.$H2] -> 0.0926966292134832 | Z13: of:=[.Z2]/[.$H2] -> 0.0674157303370787 | AA13: of:=[.AA2]/[.$H2] -> 1.17415730337079 | AB13: of:=[.AB2]/[.$H2] -> 0.320224719101124 | AC13: of:=[.AC2]/[.$H2] -> 0 | AD13: of:=[.AD2]/[.$H2] -> 1.83988764044944 | AE13: of:=[.AE2]/[.$H2] -> 0 | AF13: of:=[.AF2]/[.$H2] -> 0.230337078651685 | AG13: of:=[.AG2]/[.$H2] -> 1.69101123595506 | AH13: of:=[.AH2]/[.$H2] -> 0.0617977528089888 | AI13: of:=[.AI2]/[.$H2] -> 0 | AJ13: of:=[.AJ2]/[.$H2] -> 2.32022471910112 | AK13: of:=[.AK2]/[.$H2] -> 0.0842696629213483 | AL13: of:=[.AL2]/[.$H2] -> 0.00842696629213483 | AM13: of:=[.AM2]/[.$H2] -> 1.05056179775281 | AN13: of:=[.AN2]/[.$H2] -> 0.0112359550561798 | AO13: of:=[.AO2]/[.$H2] -> 0.382022471910112 | AP13: of:=[.AP2]/[.$H2] -> 0.382022471910112 | AQ13: of:=[.AQ2]/[.$H2] -> 0.0646067415730337 | AR13: of:=[.AR2]/[.$H2] -> 0 | AS13: of:=[.AS2]/[.$H2] -> 0 | AT13: of:=[.AT2]/[.$H2] -> 0.0337078651685393 | AU13: of:=[.AU2]/[.$H2] -> 0
B14: of:=[.B3] -> Veracode | O14: of:=[.B3] -> Veracode | P14: Raw tool output | Q14: of:=[.Q3]/[.$H3] -> 3.89636318820445 | R14: of:=[.R3]/[.$H3] -> 0.0446590628991418 | S14: of:=[.S3]/[.$H3] -> 0.17193627176373 | T14: of:=[.T3]/[.$H3] -> 0.000672238779214377 | U14: of:=[.U3]/[.$H3] -> 0.0666188630201448 | V14: of:=[.V3]/[.$H3] -> 42.6495619243956 | W14: of:=[.W3]/[.$H3] -> 0 | X14: of:=[.X3]/[.$H3] -> 0.00224079593071459 | Y14: of:=[.Y3]/[.$H3] -> 0.192103435140162 | Z14: of:=[.Z3]/[.$H3] -> 0 | AA14: of:=[.AA3]/[.$H3] -> 0 | AB14: of:=[.AB3]/[.$H3] -> 0 | AC14: of:=[.AC3]/[.$H3] -> 0.00253209940170749 | AD14: of:=[.AD3]/[.$H3] -> 0 | AE14: of:=[.AE3]/[.$H3] -> 0 | AF14: of:=[.AF3]/[.$H3] -> 0.000963542250207274 | AG14: of:=[.AG3]/[.$H3] -> 0 | AH14: of:=[.AH3]/[.$H3] -> 1.26611692473166 | AI14: of:=[.AI3]/[.$H3] -> 0 | AJ14: of:=[.AJ3]/[.$H3] -> 0 | AK14: of:=[.AK3]/[.$H3] -> 0.937750689044749 | AL14: of:=[.AL3]/[.$H3] -> 0 | AM14: of:=[.AM3]/[.$H3] -> 0 | AN14: of:=[.AN3]/[.$H3] -> 0 | AO14: of:=[.AO3]/[.$H3] -> 0 | AP14: of:=[.AP3]/[.$H3] -> 0 | AQ14: of:=[.AQ3]/[.$H3] -> 0 | AR14: of:=[.AR3]/[.$H3] -> 0 | AS14: of:=[.AS3]/[.$H3] -> 0 | AT14: of:=[.AT3]/[.$H3] -> 0.110135119994622
B15: of:=[.B4] -> Branding Brand | O15: of:=[.B4] -> Branding Brand | P15: Expert code review/pen testing aided by commercial tools | Q15: of:=[.Q4]/[.$H4] -> 0.045 | R15: of:=[.R4]/[.$H4] -> 0 | S15: of:=[.S4]/[.$H4] -> 0.01 | T15: of:=[.T4]/[.$H4] -> 0.62 | U15: of:=[.U4]/[.$H4] -> 0.38 | V15: of:=[.V4]/[.$H4] -> 3.405 | W15: of:=[.W4]/[.$H4] -> 0.095 | X15: of:=[.X4]/[.$H4] -> 0.03 | Y15: of:=[.Y4]/[.$H4] -> 0.11 | Z15: of:=[.Z4]/[.$H4] -> 0.035 | AA15: of:=[.AA4]/[.$H4] -> 0.07 | AB15: of:=[.AB4]/[.$H4] -> 0.745 | AC15: of:=[.AC4]/[.$H4] -> 0 | AD15: of:=[.AD4]/[.$H4] -> 0.51 | AE15: of:=[.AE4]/[.$H4] -> 0.345 | AF15: of:=[.AF4]/[.$H4] -> 0.915 | AG15: of:=[.AG4]/[.$H4] -> 0.275 | AH15: of:=[.AH4]/[.$H4] -> 0.13 | AI15: of:=[.AI4]/[.$H4] -> 0.165 | AJ15: of:=[.AJ4]/[.$H4] -> 0.91 | AK15: of:=[.AK4]/[.$H4] -> 0 | AL15: of:=[.AL4]/[.$H4] -> 0.005 | AM15: of:=[.AM4]/[.$H4] -> 0.135 | AN15: of:=[.AN4]/[.$H4] -> 0 | AO15: of:=[.AO4]/[.$H4] -> 0.04 | AP15: of:=[.AP4]/[.$H4] -> 0.245 | AQ15: of:=[.AQ4]/[.$H4] -> 0 | AR15: of:=[.AR4]/[.$H4] -> 0 | AS15: of:=[.AS4]/[.$H4] -> 0 | AT15: of:=[.AT4]/[.$H4] -> 0
B16: of:=[.B5] -> Paladion Networks | O16: of:=[.B5] -> Paladion Networks | P16: Expert Pen Testing aided by commercial DAST tools | Q16: of:=[.Q5]/[.$H5] -> 0.557142857142857 | R16: of:=[.R5]/[.$H5] -> 0 | S16: of:=[.S5]/[.$H5] -> 0.01 | T16: of:=[.T5]/[.$H5] -> 0.285714285714286 | U16: of:=[.U5]/[.$H5] -> 0.557142857142857 | V16: of:=[.V5]/[.$H5] -> 0.742857142857143 | W16: of:=[.W5]/[.$H5] -> 0.0107142857142857 | X16: of:=[.X5]/[.$H5] -> 0.378571428571429 | Y16: of:=[.Y5]/[.$H5] -> 0.0928571428571429 | Z16: of:=[.Z5]/[.$H5] -> 0.785714285714286 | AA16: of:=[.AA5]/[.$H5] -> 0.285714285714286 | AB16: of:=[.AB5]/[.$H5] -> 0.728571428571429 | AC16: of:=[.AC5]/[.$H5] -> 0.121428571428571 | AD16: of:=[.AD5]/[.$H5] -> 0.025 | AE16: of:=[.AE5]/[.$H5] -> 0.217142857142857 | AF16: of:=[.AF5]/[.$H5] -> 0.312142857142857 | AG16: of:=[.AG5]/[.$H5] -> 0.0285714285714286 | AH16: of:=[.AH5]/[.$H5] -> 0.0357142857142857 | AI16: of:=[.AI5]/[.$H5] -> 0.0342857142857143 | AJ16: of:=[.AJ5]/[.$H5] -> 0.642857142857143 | AK16: of:=[.AK5]/[.$H5] -> 0.142857142857143 | AL16: of:=[.AL5]/[.$H5] -> 0 | AM16: of:=[.AM5]/[.$H5] -> 0.571428571428571 | AN16: of:=[.AN5]/[.$H5] -> 0 | AO16: of:=[.AO5]/[.$H5] -> 0.857142857142857 | AP16: of:=[.AP5]/[.$H5] -> 0.285714285714286 | AQ16: of:=[.AQ5]/[.$H5] -> 0.371428571428571 | AR16: of:=[.AR5]/[.$H5] -> 0.26 | AS16: of:=[.AS5]/[.$H5] -> 0 | AT16: of:=[.AT5]/[.$H5] -> 0.0142857142857143
B17: of:=[.B6] -> Vantage Point | O17: of:=[.B6] -> Vantage Point | P17: Expert code review/pen testing aided by commercial tools | Q17: of:=[.Q6]/[.$H6] -> 0.450450450450451 | R17: of:=[.R6]/[.$H6] -> 0 | S17: of:=[.S6]/[.$H6] -> 0.0540540540540541 | T17: of:=[.T6]/[.$H6] -> 0.630630630630631 | U17: of:=[.U6]/[.$H6] -> 0.00900900900900901 | V17: of:=[.V6]/[.$H6] -> 2.02702702702703 | W17: of:=[.W6]/[.$H6] -> 0 | X17: of:=[.X6]/[.$H6] -> 0.936936936936937 | Y17: of:=[.Y6]/[.$H6] -> 0.18018018018018 | Z17: of:=[.Z6]/[.$H6] -> 0.684684684684685 | AA17: of:=[.AA6]/[.$H6] -> 0 | AB17: of:=[.AB6]/[.$H6] -> 0.198198198198198 | AC17: of:=[.AC6]/[.$H6] -> 0.135135135135135 | AD17: of:=[.AD6]/[.$H6] -> 0.045045045045045 | AE17: of:=[.AE6]/[.$H6] -> 0 | AF17: of:=[.AF6]/[.$H6] -> 0.0900900900900901 | AG17: of:=[.AG6]/[.$H6] -> 1.17117117117117 | AH17: of:=[.AH6]/[.$H6] -> 0 | AI17: of:=[.AI6]/[.$H6] -> 0 | AJ17: of:=[.AJ6]/[.$H6] -> 0 | AK17: of:=[.AK6]/[.$H6] -> 0.018018018018018 | AL17: of:=[.AL6]/[.$H6] -> 0 | AM17: of:=[.AM6]/[.$H6] -> 0 | AN17: of:=[.AN6]/[.$H6] -> 0 | AO17: of:=[.AO6]/[.$H6] -> 0 | AP17: of:=[.AP6]/[.$H6] -> 0.675675675675676 | AQ17: of:=[.AQ6]/[.$H6] -> 0.126126126126126 | AR17: of:=[.AR6]/[.$H6] -> 0 | AS17: of:=[.AS6]/[.$H6] -> 0 | AT17: of:=[.AT6]/[.$H6] -> 0
B18: of:=[.B7] -> iBLISS Segurança & Inteligência | O18: of:=[.B7] -> iBLISS Segurança & Inteligência | P18: Tools with manual false positive elimination | Q18: of:=[.Q7]/[.$H7] -> 0.114864864864865 | R18: of:=[.R7]/[.$H7] -> 0 | S18: of:=[.S7]/[.$H7] -> 0.00675675675675676 | T18: of:=[.T7]/[.$H7] -> 0 | U18: of:=[.U7]/[.$H7] -> 0.75 | V18: of:=[.V7]/[.$H7] -> 0.317567567567568 | W18: of:=[.W7]/[.$H7] -> 0.0135135135135135 | X18: of:=[.X7]/[.$H7] -> 0.0337837837837838 | Y18: of:=[.Y7]/[.$H7] -> 0.195945945945946 | Z18: of:=[.Z7]/[.$H7] -> 1.06081081081081 | AA18: of:=[.AA7]/[.$H7] -> 0.668918918918919 | AB18: of:=[.AB7]/[.$H7] -> 0.777027027027027 | AC18: of:=[.AC7]/[.$H7] -> 0.00675675675675676 | AD18: of:=[.AD7]/[.$H7] -> 0.75 | AE18: of:=[.AE7]/[.$H7] -> 1.06081081081081 | AF18: of:=[.AF7]/[.$H7] -> 0.0810810810810811 | AG18: of:=[.AG7]/[.$H7] -> 0 | AH18: of:=[.AH7]/[.$H7] -> 0.0540540540540541 | AI18: of:=[.AI7]/[.$H7] -> 0 | AJ18: of:=[.AJ7]/[.$H7] -> 0.0945945945945946 | AK18: of:=[.AK7]/[.$H7] -> 0 | AL18: of:=[.AL7]/[.$H7] -> 0 | AM18: of:=[.AM7]/[.$H7] -> 0.0135135135135135 | AN18: of:=[.AN7]/[.$H7] -> 0 | AO18: of:=[.AO7]/[.$H7] -> 0.925675675675676 | AP18: of:=[.AP7]/[.$H7] -> 0.202702702702703 | AQ18: of:=[.AQ7]/[.$H7] -> 0.560810810810811 | AR18: of:=[.AR7]/[.$H7] -> 0 | AS18: of:=[.AS7]/[.$H7] -> 0 | AT18: of:=[.AT7]/[.$H7] -> 0.0405405405405405
B19: of:=[.B8] -> AsTech Consulting | O19: of:=[.B8] -> AsTech Consulting | P19: Expert code review aided by commercial SAST tools | Q19: of:=[.Q8]/[.$H8] -> 6.87037037037037 | R19: of:=[.R8]/[.$H8] -> 0 | S19: of:=[.S8]/[.$H8] -> 0.0185185185185185 | T19: of:=[.T8]/[.$H8] -> 6.87037037037037 | U19: of:=[.U8]/[.$H8] -> 1.38888888888889 | V19: of:=[.V8]/[.$H8] -> 37.2592592592593 | W19: of:=[.W8]/[.$H8] -> 0 | X19: of:=[.X8]/[.$H8] -> 0 | Y19: of:=[.Y8]/[.$H8] -> 3.24074074074074 | Z19: of:=[.Z8]/[.$H8] -> 0.0555555555555556 | AA19: of:=[.AA8]/[.$H8] -> 7.77777777777778 | AB19: of:=[.AB8]/[.$H8] -> 0 | AC19: of:=[.AC8]/[.$H8] -> 5.92592592592593 | AD19: of:=[.AD8]/[.$H8] -> 4.74074074074074 | AE19: of:=[.AE8]/[.$H8] -> 0.0555555555555556 | AF19: of:=[.AF8]/[.$H8] -> 3.03703703703704 | AG19: of:=[.AG8]/[.$H8] -> 0 | AH19: of:=[.AH8]/[.$H8] -> 0.111111111111111 | AI19: of:=[.AI8]/[.$H8] -> 0 | AJ19: of:=[.AJ8]/[.$H8] -> 0 | AK19: of:=[.AK8]/[.$H8] -> 0 | AL19: of:=[.AL8]/[.$H8] -> 0 | AM19: of:=[.AM8]/[.$H8] -> 0 | AN19: of:=[.AN8]/[.$H8] -> 0 | AO19: of:=[.AO8]/[.$H8] -> 27.3518518518518 | AP19: of:=[.AP8]/[.$H8] -> 18.7962962962963 | AQ19: of:=[.AQ8]/[.$H8] -> 0.314814814814815 | AR19: of:=[.AR8]/[.$H8] -> 1.31481481481481 | AS19: of:=[.AS8]/[.$H8] -> 0 | AT19: of:=[.AT8]/[.$H8] -> 0
B20: of:=[.B9] -> Contrast Security | O20: of:=[.B9] -> Contrast Security | P20: Raw tool output | Q20: of:=[.Q9]/[.$H9] -> 2.01017675415104 | R20: of:=[.R9]/[.$H9] -> 0.0200856989823246 | S20: of:=[.S9]/[.$H9] -> 0.0524906266738083 | T20: of:=[.T9]/[.$H9] -> 0.855918585966792 | U20: of:=[.U9]/[.$H9] -> 0.149437600428495 | V20: of:=[.V9]/[.$H9] -> 3.70808784145688 | W20: of:=[.W9]/[.$H9] -> 0.00160685591858597 | X20: of:=[.X9]/[.$H9] -> 0.870380289234065 | Y20: of:=[.Y9]/[.$H9] -> 0.78896625602571 | Z20: of:=[.Z9]/[.$H9] -> 0.450990894483128 | AA20: of:=[.AA9]/[.$H9] -> 2.53160149973219 | AB20: of:=[.AB9]/[.$H9] -> 0.17139796464917 | AC20: of:=[.AC9]/[.$H9] -> 0.159078735940011 | AD20: of:=[.AD9]/[.$H9] -> 1.99758971612212 | AE20: of:=[.AE9]/[.$H9] -> 0.01794322442421 | AF20: of:=[.AF9]/[.$H9] -> 0.0200856989823246 | AG20: of:=[.AG9]/[.$H9] -> 0.649437600428495 | AH20: of:=[.AH9]/[.$H9] -> 0.103106588109266 | AI20: of:=[.AI9]/[.$H9] -> 0.200856989823246 | AJ20: of:=[.AJ9]/[.$H9] -> 0.489019817889663 | AK20: of:=[.AK9]/[.$H9] -> 0.0511515800749866 | AL20: of:=[.AL9]/[.$H9] -> 0.0511515800749866 | AM20: of:=[.AM9]/[.$H9] -> 0 | AN20: of:=[.AN9]/[.$H9] -> 0.000535618639528656 | AO20: of:=[.AO9]/[.$H9] -> 0.152115693626138 | AP20: of:=[.AP9]/[.$H9] -> 0.380824852704874 | AQ20: of:=[.AQ9]/[.$H9] -> 0.0200856989823246 | AR20: of:=[.AR9]/[.$H9] -> 0.132029994643814 | AS20: of:=[.AS9]/[.$H9] -> 0 | AT20: of:=[.AT9]/[.$H9] -> 0.0281199785752544
B21: of:=[.B10] -> Minded Security | O21: of:=[.B10] -> Minded Security | P21: Expert code review/pen testing aided by free tools | Q21: of:=[.Q10]/[.$H10] -> 1.4 | R21: of:=[.R10]/[.$H10] -> 0 | S21: of:=[.S10]/[.$H10] -> 0.0727272727272727 | T21: of:=[.T10]/[.$H10] -> 0.927272727272727 | U21: of:=[.U10]/[.$H10] -> 1 | V21: of:=[.V10]/[.$H10] -> 9.81818181818182 | W21: of:=[.W10]/[.$H10] -> 0.890909090909091 | X21: of:=[.X10]/[.$H10] -> 1.67272727272727 | Y21: of:=[.Y10]/[.$H10] -> 1.49090909090909 | Z21: of:=[.Z10]/[.$H10] -> 0.909090909090909 | AA21: of:=[.AA10]/[.$H10] -> 9.18181818181818 | AB21: of:=[.AB10]/[.$H10] -> 1.76363636363636 | AC21: of:=[.AC10]/[.$H10] -> 0.545454545454545 | AD21: of:=[.AD10]/[.$H10] -> 8.82727272727273 | AE21: of:=[.AE10]/[.$H10] -> 0 | AF21: of:=[.AF10]/[.$H10] -> 2.20909090909091 | AG21: of:=[.AG10]/[.$H10] -> 0.918181818181818 | AH21: of:=[.AH10]/[.$H10] -> 1.56363636363636 | AI21: of:=[.AI10]/[.$H10] -> 0 | AJ21: of:=[.AJ10]/[.$H10] -> 3.6 | AK21: of:=[.AK10]/[.$H10] -> 0.590909090909091 | AL21: of:=[.AL10]/[.$H10] -> 0 | AM21: of:=[.AM10]/[.$H10] -> 2.03636363636364 | AN21: of:=[.AN10]/[.$H10] -> 0 | AO21: of:=[.AO10]/[.$H10] -> 4.34545454545455 | AP21: of:=[.AP10]/[.$H10] -> 8.92727272727273 | AQ21: of:=[.AQ10]/[.$H10] -> 0 | AR21: of:=[.AR10]/[.$H10] -> 0 | AS21: of:=[.AS10]/[.$H10] -> 0 | AT21: of:=[.AT10]/[.$H10] -> 0
B22: Aspect Security | O22: of:=[.B11] -> Aspect Security | P22: Expert code review/pen testing aided by commercial tools | Q22: of:=[.Q11]/[.$H11] -> 0.0838709677419355 | R22: of:=[.R11]/[.$H11] -> 0 | S22: of:=[.S11]/[.$H11] -> 0.632258064516129 | T22: of:=[.T11]/[.$H11] -> 1.60645161290323 | U22: of:=[.U11]/[.$H11] -> 1.01290322580645 | V22: of:=[.V11]/[.$H11] -> 0.948387096774193 | W22: of:=[.W11]/[.$H11] -> 0 | X22: of:=[.X11]/[.$H11] -> 0 | Y22: of:=[.Y11]/[.$H11] -> 1.87096774193548 | Z22: of:=[.Z11]/[.$H11] -> 0.929032258064516 | AA22: of:=[.AA11]/[.$H11] -> 0.174193548387097 | AB22: of:=[.AB11]/[.$H11] -> 0.561290322580645 | AC22: of:=[.AC11]/[.$H11] -> 0.129032258064516 | AD22: of:=[.AD11]/[.$H11] -> 0.632258064516129 | AE22: of:=[.AE11]/[.$H11] -> 0 | AF22: of:=[.AF11]/[.$H11] -> 0.393548387096774 | AG22: of:=[.AG11]/[.$H11] -> 0 | AH22: of:=[.AH11]/[.$H11] -> 0.032258064516129 | AI22: of:=[.AI11]/[.$H11] -> 0 | AJ22: of:=[.AJ11]/[.$H11] -> 0 | AK22: of:=[.AK11]/[.$H11] -> 0 | AL22: of:=[.AL11]/[.$H11] -> 0 | AM22: of:=[.AM11]/[.$H11] -> 0.161290322580645 | AN22: of:=[.AN11]/[.$H11] -> 0 | AO22: of:=[.AO11]/[.$H11] -> 0.309677419354839 | AP22: of:=[.AP11]/[.$H11] -> 0 | AQ22: of:=[.AQ11]/[.$H11] -> 0 | AR22: of:=[.AR11]/[.$H11] -> 0.4 | AS22: of:=[.AS11]/[.$H11] -> 0 | AT22: of:=[.AT11]/[.$H11] -> 0
P23: Average: | Q23: of:=SUM([.Q13:.Q21])/COUNT([.Q13:.Q21]) -> 1.71335679797925 | R23: of:=SUM([.R13:.R21])/COUNT([.R13:.R21]) -> 0.00719386243127404 | S23: of:=SUM([.S13:.S21])/COUNT([.S13:.S21]) -> 0.0509201392559033 | T23: of:=SUM([.T13:.T21])/COUNT([.T13:.T21]) -> 1.13884084475322 | U23: of:=SUM([.U13:.U21])/COUNT([.U13:.U21]) -> 0.484141888196699 | V23: of:=SUM([.V13:.V21])/COUNT([.V13:.V21]) -> 11.4223486762626 | W23: of:=SUM([.W13:.W21])/COUNT([.W13:.W21]) -> 0.136136321346988 | X23: of:=SUM([.X13:.X21])/COUNT([.X13:.X21]) -> 0.453549319774524 | Y23: of:=SUM([.Y13:.Y21])/COUNT([.Y13:.Y21]) -> 0.709377713445828 | Z23: of:=SUM([.Z13:.Z21])/COUNT([.Z13:.Z21]) -> 0.449918096741828 | AA23: of:=SUM([.AA13:.AA21])/COUNT([.AA13:.AA21]) -> 2.4099986630369 | AB23: of:=SUM([.AB13:.AB21])/COUNT([.AB13:.AB21]) -> 0.522672855687035 | AC23: of:=SUM([.AC13:.AC21])/COUNT([.AC13:.AC21]) -> 0.766256863338072 | AD23: of:=SUM([.AD13:.AD21])/COUNT([.AD13:.AD21]) -> 2.08172620773667 | AE23: of:=SUM([.AE13:.AE21])/COUNT([.AE13:.AE21]) -> 0.188494716437048 | AF23: of:=SUM([.AF13:.AF21])/COUNT([.AF13:.AF21]) -> 0.766203143814021 | AG23: of:=SUM([.AG13:.AG21])/COUNT([.AG13:.AG21]) -> 0.525930361589774 | AH23: of:=SUM([.AH13:.AH21])/COUNT([.AH13:.AH21]) -> 0.369504120018415 | AI23: of:=SUM([.AI13:.AI21])/COUNT([.AI13:.AI21]) -> 0.0444603004565511 | AJ23: of:=SUM([.AJ13:.AJ21])/COUNT([.AJ13:.AJ21]) -> 0.895188474938058 | AK23: of:=SUM([.AK13:.AK21])/COUNT([.AK13:.AK21]) -> 0.202772909313926 | AL23: of:=SUM([.AL13:.AL21])/COUNT([.AL13:.AL21]) -> 0.00717539404079127 | AM23: of:=SUM([.AM13:.AM21])/COUNT([.AM13:.AM21]) -> 0.422985279895392 | AN23: of:=SUM([.AN13:.AN21])/COUNT([.AN13:.AN21]) -> 0.00130795263285649 | AO23: of:=SUM([.AO13:.AO21])/COUNT([.AO13:.AO21]) -> 3.78380701062902 | AP23: of:=SUM([.AP13:.AP21])/COUNT([.AP13:.AP21]) -> 3.3217232235863 | AQ23: of:=SUM([.AQ13:.AQ21])/COUNT([.AQ13:.AQ21]) -> 0.161985862637298 | AR23: of:=SUM([.AR13:.AR21])/COUNT([.AR13:.AR21]) -> 0.189649423273181 | AS23: of:=SUM([.AS13:.AS21])/COUNT([.AS13:.AS21]) -> 0 | AT23: of:=SUM([.AT13:.AT21])/COUNT([.AT13:.AT21]) -> 0.0251988020627412
P24: # of Entries: | Q24: of:=COUNT([.Q13:.Q22]) -> 10 | R24: of:=COUNT([.R13:.R22]) -> 10 | S24: of:=COUNT([.S13:.S22]) -> 10 | T24: of:=COUNT([.T13:.T22]) -> 10 | U24: of:=COUNT([.U13:.U22]) -> 10 | V24: of:=COUNT([.V13:.V22]) -> 10 | W24: of:=COUNT([.W13:.W22]) -> 10 | X24: of:=COUNT([.X13:.X22]) -> 10 | Y24: of:=COUNT([.Y13:.Y22]) -> 10 | Z24: of:=COUNT([.Z13:.Z22]) -> 10 | AA24: of:=COUNT([.AA13:.AA22]) -> 10 | AB24: of:=COUNT([.AB13:.AB22]) -> 10 | AC24: of:=COUNT([.AC13:.AC22]) -> 10 | AD24: of:=COUNT([.AD13:.AD22]) -> 10 | AE24: of:=COUNT([.AE13:.AE22]) -> 10 | AF24: of:=COUNT([.AF13:.AF22]) -> 10 | AG24: of:=COUNT([.AG13:.AG22]) -> 10 | AH24: of:=COUNT([.AH13:.AH22]) -> 10 | AI24: of:=COUNT([.AI13:.AI22]) -> 10 | AJ24: of:=COUNT([.AJ13:.AJ22]) -> 10 | AK24: of:=COUNT([.AK13:.AK22]) -> 10 | AL24: of:=COUNT([.AL13:.AL22]) -> 10 | AM24: of:=COUNT([.AM13:.AM22]) -> 10 | AN24: of:=COUNT([.AN13:.AN22]) -> 10 | AO24: of:=COUNT([.AO13:.AO22]) -> 10 | AP24: of:=COUNT([.AP13:.AP22]) -> 10 | AQ24: of:=COUNT([.AQ13:.AQ22]) -> 10 | AR24: of:=COUNT([.AR13:.AR22]) -> 10 | AS24: of:=COUNT([.AS13:.AS22]) -> 10 | AT24: of:=COUNT([.AT13:.AT22]) -> 10
A29: Attack Info
B30: https://www.akamai.com/us/en/multimedia/documents/state-of-the-internet/akamai-q1-2016-state-of-the-internet-security-report.pdf

Sheet: LargeDataSets
A1: Name of Company/Organization | D1: Edgescan | F1: Veracode | H1: Branding Brand | J1: Paladion Networks | L1: Vantage Point | N1: iBLISS Segurança & Inteligência | P1: AsTech Consulting | R1: Contrast Security | T1: Minded Security | V1: Aspect Security | X1: Softtek
A2: Company/Organization Web Site | F2: https://www.veracode.com/ | H2: www.brandingbrand.com | J2: www.paladion.net | L2: www.vantagepoint.sg | N2: www.ibliss.com.br | P2: https://www.astechconsulting.com | R2: http://contrastsecurity.com | T2: https://www.mindedsecurity.com/ | V2: www.aspectsecurity.com | X2: http://www.softtek.com/
A3: Point of Contact E-Mail | D3: eoin@edgescan.com | F3: tjarrett@veracode.com | H3: alex.cline@brandingbrand.com | J3: prashant.verma@paladion.net | L3: gerhard@vantagepoint.sg | N3: bruno.freire@ibliss.com.br | P3: jason.white@owasp.org | R3: jeff.williams@contrastsecurity.com | T3: gianrico.ingrosso@mindedsecurity.com | V3: john.pavone@aspectsecurity.com | X3: julio.maldonado@softtek.com, martha.salgado@softtek.com, raul.muro@softtek.com
A4: During what year(s) was this data collected? | D4: Both 2014 & 2015 | F4: 2015 | H4: Both 2014 & 2015 | J4: Both 2014 & 2015 | L4: 2015 | N4: Both 2014 & 2015 | P4: Both 2014 & 2015 | R4: 2015 | T4: Both 2014 & 2015 | V4: Both 2014 & 2015 | X4: Both 2014 & 2015
A5: If the application vulnerability data you are submitting was extracted from a publicly available report, please provide a link to that report (or reports), and the relevant page number(s) | J5: NA | L5: http://www.vantagepoint.sg/blog/69-owasp-top-10-data-call-submission | R5: Data is from a random sample of client applications using Contrast Enterprise SAAS edition only (not Contrast On-Premise edition)
A6: How many web applications do the submitted results cover? | D6: 356 | F6: 44627 | H6: 200 | J6: 1400 | L6: 111 | N6: 148 | P6: 54 | R6: 3734 | T6: 110 | V6: 155 | X6: 2490
A7: What were the primary programming languages the applications you reviewed written in? | D7: Java, .NET, PHP | F7: Java, .NET, PHP | H7: Java, PHP, Node.js, Objective-C | J7: Java, .NET, PHP | L7: Java, .NET, PHP | N7: Java, .NET, PHP | P7: Java, .NET | R7: Java, .NET, Node.js | T7: Java, .NET, PHP | V7: Java, .NET | X7: Java;.NET;PHP;Play;Oracle
A8: Please supply the exact percentage of applications per language checked off above: | D8: Java = 45%. .Net = 45% PHP=10% | F8: Java - 53.4%, .NET - 33.1%, PHP - 5.4% | H8: Node.js - 80%, PHP 10%, Java 5%, Objective-C 5% | J8: Java 70%, .NET 10%, PHP 12% | N8: 56% Java, 33% .Net, 11% PHP | P8: Java - 54%, .Net-24% | R8: 67% Java, 28% .NET, 5% Node.js | X8: Java: 62.5%, .NET: 10.3%, PHP: 7.2%, Oracle: 7.9%,
A9: What were the primary industries these applications supported? | D9: Financial, Healthcare, eCommerce, Energy, Government, Gaming | F9: Financial, eCommerce, Internet/Social Media, Commercial software, telecommunications, manufacturing, education | H9: eCommerce | J9: Financial, eCommerce, Internet/Social Media, Government | L9: Financial, eCommerce, Internet/Social Media, Entertainment (Games/Music/Movies), Government | N9: Financial, Healthcare, eCommerce, Internet/Social Media, Entertainment (Games/Music/Movies), Government, Defense | P9: Financial, Healthcare | R9: Financial, Healthcare, eCommerce, Entertainment (Games/Music/Movies), Government | V9: Financial, Government, Healthcare, Technology Services, Defense, Airline, Retail, Education | X9: Healthcare;eCommerce;Airline;Energy;Bank, Financial Services, Transportation
A10: Where in the world were the application owners primarily? | D10: North America, Europe, Middle East | H10: North America | J10: North America, AsiaPac, Middle East | L10: AsiaPac | N10: South America | P10: North America | R10: North America, Europe, AsiaPac | T10: North America, Europe | V10: North America, Europe | X10: North America;Europe;AsiaPac
A11: What type of team did the bulk of this work? | D11: Consulting Organization | F11: Product Vendor/Service Provider (e.g., SaaS) | H11: Internal Assessment Team(s) | J11: Consulting Organization | L11: Consulting Organization | N11: Internal Assessment Team(s) | P11: Consulting Organization | R11: Product Vendor/Service Provider (e.g., SaaS) | T11: Consulting Organization | V11: Consulting Organization | X11: Internal Assessment Team(s)
A12: What type of analysis tools do they use? | D12: Free/Open Source Dynamic Application Security Testing (DAST) Tools, Commercial Dynamic Application Security Testing (DAST) Tools, edgescan bespoke engine | F12: Commercial Static Application Security Testing (SAST) Tools, Commercial Dynamic Application Security Testing (DAST) Tools | H12: Free/Open Source Static Application Security Testing (SAST) Tools, Free/Open Source Dynamic Application Security Testing (DAST) Tools, Commercial Static Application Security Testing (SAST) Tools, Commercial Dynamic Application Security Testing (DAST) Tools | J12: Commercial Static Application Security Testing (SAST) Tools, Commercial Dynamic Application Security Testing (DAST) Tools | L12: Free/Open Source Static Application Security Testing (SAST) Tools, Free/Open Source Dynamic Application Security Testing (DAST) Tools, Commercial Static Application Security Testing (SAST) Tools, Commercial Dynamic Application Security Testing (DAST) Tools | N12: Free/Open Source Static Application Security Testing (SAST) Tools, Free/Open Source Dynamic Application Security Testing (DAST) Tools, Free/Open Source Interactive Application Security Testing (IAST) Tools, Commercial Dynamic Application Security Testing (DAST) Tools | P12: Commercial Static Application Security Testing (SAST) Tools, Commercial Dynamic Application Security Testing (DAST) Tools | R12: Commercial Interactive Application Security Testing (IAST) Tools | T12: Free/Open Source Static Application Security Testing (SAST) Tools, Free/Open Source Dynamic Application Security Testing (DAST) Tools, Commercial Dynamic Application Security Testing (DAST) Tools | V12: Free & Commercial Dynamic Application Security Testing (DAST) Tools, Commercial Static Application Security Testing (SAST) Tools, Commercial Interactive Application Security Testing (IAST) Tools | X12: Free/Open Source Static Application Security Testing (SAST) Tools;Free/Open Source Dynamic Application Security Testing (DAST) Tools;Commercial Static Application Security Testing (SAST) Tools;Commercial Dynamic Application Security Testing (DAST) Tools
A13: Which analysis tools do you frequently use? | D13: edgescan, Burp, Acunetix, OWASP Zap | F13: Veracode Static Analysis, Veracode DynamicDS, Veracode DynamicMP | H13: Nessus, Checkmarx, Bespoke Analysis, HackerGuardian | J13: Burp Suite Pro, NetSparker | N13: OWASP ZAP, Acunetix, Burp, mantra | R13: Contrast Enterprise Edition | V13: Burp Pro, OWASP ZAP, Contrast, Fortify, IBM AppScan Source | X13: Checkmarx, Nessus, nMap, Fiddler, Burp, HP Web Inspect, OWASP ZAP, WIreshark, Paros, AppSentry, Kali Linux, SoapUI
A14: What is your primary assessment methodology? | B14: Totals | C14: Percentage | D14: Output from manually tailored automated analysis tool(s) - with manual false positive analysis/elimination | F14: Raw output of automated analysis tools, using rules tuned by earlier stage manual false positive analysis | H14: Combined manual expert code review and penetration testing with only commercial tools | J14: Manual expert penetration testing with commercial DAST tool(s) | L14: manual expert penetration testing or/and code review coupled with commercial as well as free DAST and SAST tools | N14: Output from manually tailored automated analysis tool(s) - with manual false positive analysis/elimination | P14: Manual expert code review with commercial SAST tool(s) | R14: Raw (untriaged) output of automated analysis tool results using default rules | T14: Combined manual expert code review and penetration testing with only free tools | V14: manual expert penetration testing or/and code review coupled with commercial DAST/SAST/IAST tools and free DAST/SAST tools | X14: Combined manual expert code review and penetration testing with free and commercial tools, Automated analysis tool results - with manual false positive analysis/elimination
A15: Number of SQL Injection Vulnerabilities Found (CWE-89)? | B15: of:=SUM([.D15:.V15]) -> 182810 | C15: of:=[.B15]/[.$B$47] -> 0.0794101038182529 | D15: 27 | F15: 173883 | H15: 9 | J15: 780 | L15: 50 | N15: 17 | P15: 371 | R15: 7506 | T15: 154 | V15: 13 | X15: 267
A16: Number of Hibernate Injection Vulnerabilities Found (CWE-564)? | B16: of:=SUM([.D16:.V16]) -> 2068 | C16: of:=[.B16]/[.$B$47] -> 0.000898310238477911 | D16: 0 | F16: 1993 | H16: 0 | J16: 0 | L16: 0 | N16: 0 | P16: 0 | R16: 75 | X16: 4
A17: Number of Command Injection Vulnerabilities Found (CWE-77)? | B17: of:=SUM([.D17:.V17]) -> 8021 | C17: of:=[.B17]/[.$B$47] -> 0.00348421006906737 | D17: 22 | F17: 7673 | H17: 2 | J17: 14 | L17: 6 | N17: 1 | P17: 1 | R17: 196 | T17: 8 | V17: 98 | X17: 22
A18: Number of Authentication Vulnerabilities Found (CWE-287)? | B18: of:=SUM([.D18:.V18]) -> 4563 | C18: of:=[.B18]/[.$B$47] -> 0.00198210329698971 | D18: 21 | F18: 30 | H18: 124 | J18: 400 | L18: 70 | P18: of:=176+64+131 -> 371 | R18: 3196 | T18: 102 | V18: of:=219+30 -> 249 | X18: 4281
A19: Number of Session Fixation Vulnerabilities Found (CWE-384)? | B19: of:=SUM([.D19:.V19]) -> 4861 | C19: of:=[.B19]/[.$B$47] -> 0.00211155032361757 | D19: 20 | F19: 2973 | H19: 76 | J19: 780 | L19: 1 | N19: 111 | P19: of:=9+57+9 -> 75 | R19: 558 | T19: 110 | V19: 157 | X19: 4
A20: Number of Cross-Site Scripting (XSS) Vulnerabilities Found (CWE-79)? | B20: of:=SUM([.D20:.V20]) -> 1923423 | C20: of:=[.B20]/[.$B$47] -> 0.835508014421615 | D20: 1023 | F20: 1903322 | H20: 681 | J20: 1040 | L20: of:=145+80 -> 225 | N20: 47 | P20: 2012 | R20: 13846 | T20: 1080 | V20: 147 | X20: 1626
A21: Number of DOM-Based XSS Vulnerabilities Found (No CWE)? | B21: of:=SUM([.D21:.V21]) -> 216 | C21: of:=[.B21]/[.$B$47] -> 0.0000938273750054298 | D21: 76 | H21: 19 | J21: 15 | L21: 0 | N21: 2 | P21: 0 | R21: 6 | T21: 98 | X21: 121
A22: Number of Insecure Direct Object Reference Vulnerabilities Found (CWE-639)? | B22: of:=SUM([.D22:.V22]) -> 4235 | C22: of:=[.B22]/[.$B$47] -> 0.00183962469049998 | D22: 56 | F22: 100 | H22: 6 | J22: 530 | L22: 104 | N22: 5 | P22: 0 | R22: 3250 | T22: 184 | X22: 56
A23: Number of Path Traversal Vulnerabilities Found (CWE-22)? | B23: of:=SUM([.D23:.V23]) -> 12382 | C23: of:=[.B23]/[.$B$47] -> 0.00537856739498719 | D23: 33 | F23: 8573 | H23: 22 | J23: 130 | L23: 20 | N23: 29 | P23: 175 | R23: 2946 | T23: 164 | V23: 290 | X23: 67
A24: Number of Missing Authorization Vulnerabilities Found (CWE-285)? | B24: of:=SUM([.D24:.V24]) -> 3295 | C24: of:=[.B24]/[.$B$47] -> 0.0014313018548282 | D24: 24 | H24: 7 | J24: 1100 | L24: 76 | N24: 157 | P24: 3 | R24: 1684 | T24: 100 | V24: of:=67+77 -> 144 | X24: 727
A25: Number of Security Misconfiguration Vulnerabilities Found (CWE-2)? | B25: of:=SUM([.D25:.V25]) -> 11841 | C25: of:=[.B25]/[.$B$47] -> 0.00514356457147822 | D25: 418 | H25: 14 | J25: 400 | L25: 0 | N25: 99 | P25: of:=67+353 -> 420 | R25: 9453 | T25: 1010 | V25: 27 | X25: 7210
A26: Number of Cleartext Transmission of Sensitive Information Vulnerabilities Found (CWE-319)? | B26: of:=SUM([.D26:.V26]) -> 2341 | C26: of:=[.B26]/[.$B$47] -> 0.00101689761522089 | D26: 114 | H26: 149 | J26: 1020 | L26: 22 | N26: 115 | P26: 0 | R26: 640 | T26: 194 | V26: 87 | X26: 407
A27: Number of Cleartext Storage of Sensitive Information Vulnerabilities Found (CWE-312)? | B27: of:=SUM([.D27:.V27]) -> 1293 | C27: of:=[.B27]/[.$B$47] -> 0.000561661092046392 | D27: 0 | F27: 113 | H27: 0 | J27: 170 | L27: 15 | N27: 1 | P27: of:=164+156 -> 320 | R27: 594 | T27: 60 | V27: 20 | X27: 515
A28: Number of Cryptographic Vulnerabilities Found (CWEs-310/326/327/etc)? | B28: of:=SUM([.D28:.V28]) -> 9692 | C28: of:=[.B28]/[.$B$47] -> 0.00421006906737327 | D28: 655 | H28: 102 | J28: 35 | L28: 5 | N28: 111 | P28: of:=195+15+46 -> 256 | R28: 7459 | T28: 971 | V28: 98 | X28: 69
A29: Number of Improper (Function Level) Access Control Vulnerabilities Found (CWE-285)? | B29: of:=SUM([.D29:.V29]) -> 600 | C29: of:=[.B29]/[.$B$47] -> 0.000260631597237305 | D29: 0 | H29: 69 | J29: 304 | L29: 0 | N29: 157 | P29: 3 | R29: 67 | X29: 727
A30: Number of Cross-Site Request Forgery (CSRF) Vulnerabilities Found (CWE-352)? | B30: of:=SUM([.D30:.V30]) -> 1310 | C30: of:=[.B30]/[.$B$47] -> 0.000569045653968116 | D30: 82 | F30: 43 | H30: 183 | J30: 437 | L30: 10 | N30: 12 | P30: 164 | R30: 75 | T30: 243 | V30: 61 | X30: 498
A31: Number of Use of Known Libraries Found (NEW 937)? | B31: of:=SUM([.D31:.V31]) -> 3353 | C31: of:=[.B31]/[.$B$47] -> 0.00145649624256114 | D31: 602 | H31: 55 | J31: 40 | L31: 130 | N31: 0 | P31: 0 | R31: 2425 | T31: 101 | X31: 0
A32: Number of Unchecked Redirect Vulnerabilities Found (CWE-601)? | B32: of:=SUM([.D32:.V32]) -> 57177 | C32: of:=[.B32]/[.$B$47] -> 0.024836888058729 | D32: 22 | F32: 56503 | H32: 26 | J32: 50 | L32: 0 | N32: 8 | P32: 6 | R32: 385 | T32: 172 | V32: 5 | X32: 220
A33: Number of Unvalidated Forward Vulnerabilities Found (No CWE)? | B33: of:=SUM([.D33:.V33]) -> 831 | C33: of:=[.B33]/[.$B$47] -> 0.000360974762173667 | D33: 0 | H33: 33 | J33: 48 | L33: 0 | P33: 0 | R33: 750 | X33: 50
A34: Number of Clickjacking Vulnerabilities Found (No CWE)? | B34: of:=SUM([.D34:.V34]) -> 4144 | C34: of:=[.B34]/[.$B$47] -> 0.00180009556491899 | D34: 826 | H34: 182 | J34: 900 | L34: 0 | N34: 14 | P34: 0 | R34: 1826 | T34: 396 | X34: 48
A35: Number of XML eXternal Entity Injection (XXE) Vulnerabilities Found (CWE-611)? | B35: of:=SUM([.D35:.V35]) -> 42337 | C35: of:=[.B35]/[.$B$47] -> 0.0183905998870596 | D35: 30 | F35: 41849 | J35: 200 | L35: 2 | N35: 0 | P35: 0 | R35: 191 | T35: 65 | X35: 10
A36: Number of Server-Side Request Forgery (SSRF) Vulnerabilities Found (CWE-918)? | B36: of:=SUM([.D36:.V36]) -> 195 | C36: of:=[.B36]/[.$B$47] -> 0.0000847052691021242 | D36: 3 | H36: 1 | J36: 0 | L36: 0 | N36: 0 | P36: 0 | R36: 191 | X36: 0
A37: Number of Denial of Service (DOS) Vulnerabilities Found (CWE-400)? | B37: of:=SUM([.D37:.V37]) -> 1452 | C37: of:=[.B37]/[.$B$47] -> 0.000630728465314278 | D37: 374 | H37: 27 | J37: 800 | L37: 0 | N37: 2 | P37: 0 | T37: 224 | V37: 25 | X37: 55
A38: Number of Expression Language Injection Vulnerabilities Found (CWE-917)? | B38: of:=SUM([.D38:.V38]) -> 6 | C38: of:=[.B38]/[.$B$47] -> 0.00000260631597237305 | D38: 4 | J38: 0 | L38: 0 | N38: 0 | P38: 0 | R38: 2 | X38: 4
A39: Number of Error Handling Vulnerabilities Found (CWE-388)? | B39: of:=SUM([.D39:.V39]) -> 4052 | C39: of:=[.B39]/[.$B$47] -> 0.0017601320533426 | D39: 136 | H39: 8 | J39: 1200 | L39: 0 | N39: 137 | P39: 1477 | R39: 568 | T39: 478 | V39: 48 | X39: 676
A40: Number of Information Leakage/Disclosure Vulnerabilities Found (CWE-200)? | B40: of:=SUM([.D40:.V40]) -> 4109 | C40: of:=[.B40]/[.$B$47] -> 0.00178489205508014 | D40: 136 | H40: 49 | J40: 400 | L40: 75 | N40: 30 | P40: of:=308+48+1+658 -> 1015 | R40: 1422 | T40: 982 | X40: 1716
A41: Number of Insufficient Anti-automation Vulnerabilities Found (CWE-799)? | B41: of:=SUM([.D41:.V41]) -> 732 | C41: of:=[.B41]/[.$B$47] -> 0.000317970548629512 | D41: 23 | J41: 520 | L41: 14 | N41: 83 | P41: of:=17 -> 17 | R41: 75 | X41: 28
A42: Number of Insufficient Security Logging Vulnerabilities Found (CWE-778)? | B42: of:=SUM([.D42:.V42]) -> 990 | C42: of:=[.B42]/[.$B$47] -> 0.000430042135441553 | D42: 0 | J42: 364 | P42: 71 | R42: 493 | V42: of:=60+2 -> 62 | X42: 7
A43: Number of Insufficient Intrusion Detection and Response Vulnerabilities Found (No CWE)? | B43: of:=SUM([.D43:.V43]) -> 0 | C43: of:=[.B43]/[.$B$47] -> 0 | D43: 0 | J43: 0 | N43: 0 | P43: 0 | X43: 15
A44: Number of Mass Assignment Vulnerabilities Found (CWE-915)? | B44: of:=SUM([.D44:.V44]) -> 5058 | C44: of:=[.B44]/[.$B$47] -> 0.00219712436471048 | D44: 12 | F44: 4915 | J44: 20 | N44: 6 | P44: 0 | R44: 105 | X44: 78
A45: Input Validation | B45: of:=SUM([.D45:.V45]) -> 4699 | C45: of:=[.B45]/[.$B$47] -> 0.00204117979236349 | P45: of:=4676+23 -> 4699
A46: Unrestricted Upload of File with Dangerous Type (CWE-434) | B46: of:=SUM([.D46:.V46]) -> 14 | C46: of:=[.B46]/[.$B$47] -> 0.00000608140393553712 | L46: 14
A47: Totals: | B47: of:=SUM([.B15:.B46]) -> 2302100 | D47: of:=SUM([.D15:.D46]) -> 4739 | F47: of:=SUM([.F15:.F46]) -> 2201970 | H47: of:=SUM([.H15:.H46]) -> 1844 | J47: of:=SUM([.J15:.J46]) -> 11697 | L47: of:=SUM([.L15:.L46]) -> 839 | N47: of:=SUM([.N15:.N46]) -> 1144 | P47: of:=SUM([.P15:.P46]) -> 11456 | R47: of:=SUM([.R15:.R46]) -> 59984 | T47: of:=SUM([.T15:.T46]) -> 6896 | V47: of:=SUM([.V15:.V46]) -> 1531 | X47: of:=SUM([.X15:.X46]) -> 19508
A49: What other vulnerabilities did you find? | D49: XML Injection - 23 Exposed Admin Interface: 11 | F49: via email | H49: Cross Site History Manipulation, 203, 6 Client Insecure Randomness, 330, 29 Privacy Violation, 359, 11 HTML/Cookie Injection, 94, 433 Remote File Inclusion, 829, 23 Regex Injection, 624, 10 | R49: Sent in email | T49: User enumeration, CWE 203, 158 HTTP Response splitting, CWE 113, 62 Insecure session cookie, CWE 614, 316 Weak Password policy, CWE 521, 84 Arbitrary file upload, CWE 434, 188 No Session timeout, CWE 613, 65 LDAP injection, CWE 90, 57 View state MAC disabled, No CWE, 60 Insecure logout, No CWE, 55 Concurrent sessions permitted, No CWE, 102 Incorrect Content-Type in JSON responses, No CWE, 70
A50: Vulnerability types you think should be added to the T10? | D50: SSL/HTTPS as a specific Topic? | F50: CWE 611 -- almost as many applications affected as CWE 89, also bears info disclosure risk (if application is deployed in the cloud). | H50: Explicitly calling out Regular Expression Injection and DoS vulnerabilities. | J50: SQL Injection and Other Injection attacks can be separated. 95% of our discovered injection attacks are SQL Injection. Similarly Broken Authentication & Session Management can be separated into two different categories. | L50: CWE-434: Unrestricted Upload of File with Dangerous Type | R50: Lack of attack detection/prevention, unprotected APIs, XXE, untrusted deserialization, use of non-standard controls, weak HTTP headers
A51: Vulnerability types you think should be removed from the T10? | D51: Security Misconfiguration - Change to "Poor maintenance / insecure deployment" | J51: "Using components with known vulnerabilities" can be a subset of "Security Misconfiguration" as patched components are not used.
A52: Suggested changes to the Top 10 Document/Wiki? | D52: None, its great | F52: More transparent documentation of data collection methodology from contributors. For instance, Veracode's statement would be: collected from applications on their first scan by a particular SAAS vendor, excluding results from languages written in primarily non-web languages (ObjectiveC, Swift, C/C++, VB6) | J52: If CWEs can be listed down against each Top 10 that will be of great help to pentesters. | P52: The difficulty with Top 10 is the density and categorization. When unpacked, there are many more than 10 items and some can be cross-categorized. Highlighted somewhat in this post: https://www.astechconsulting.com/blog/2016/whats-in-a-name/ Also, maybe include risk as part of the top 10 data collection. However, that is likely to run into similar subjectivity problems as the labeling | R52: It's perfect the way it is
A53: Suggestions on how to improve this call for data? | D53: None its also a great start | F53: Shift from # of vulnerabilities found (vulnerability prevalence) to number of applications affected (app prevalence), or reporting both. Vulnerability prevalence gives you an idea of developer effort to fix; arguably app prevalence gives you an idea of the enterprise risk. | J53: Bifurcation of automated and manual pentest vulnerability count is important to arrive at real weightage to each of Top10. If data call format is available in a year advance, then more detailed data can be recorded and submitted. | P53: Will think this over some more and send thoughts along directly via email | R53: OWASP should redo the CWE correctly

Sheet: LargeDataSets-BasicAnalysis
E1: Service Provider | G1: Product Vendor | I1: Consultant | K1: Consultant | M1: Consultant | O1: Consultant | Q1: Consultant | S1: Product Vendor | U1: Consultant | W1: Consultant | Y1: Consultant
A2: 2013 Top 10 - Area | B2: CWE #s | C2: 2014-2015 Prevalence Rank | D2: 2014-2015 Overall Prevalence | E2: of:=CONCATENATE([$LargeDataSets.D1]; " %") -> Edgescan % | F2: of:=CONCATENATE([$LargeDataSets.D1]; " #") -> Edgescan # | G2: of:=CONCATENATE([$LargeDataSets.F1]; " %") -> Veracode % | H2: of:=CONCATENATE([$LargeDataSets.F1]; " #") -> Veracode # | I2: of:=CONCATENATE([$LargeDataSets.H1]; " %") -> Branding Brand % | J2: of:=CONCATENATE([$LargeDataSets.H1]; " #") -> Branding Brand # | K2: of:=CONCATENATE([$LargeDataSets.J1]; " %") -> Paladion Networks % | L2: of:=CONCATENATE([$LargeDataSets.J1]; " #") -> Paladion Networks # | M2: of:=CONCATENATE([$LargeDataSets.L1]; " %") -> Vantage Point % | N2: of:=CONCATENATE([$LargeDataSets.L1]; " #") -> Vantage Point # | O2: of:=CONCATENATE([$LargeDataSets.N1]; " %") -> iBLISS Segurança & Inteligência % | P2: of:=CONCATENATE([$LargeDataSets.N1]; " #") -> iBLISS Segurança & Inteligência # | Q2: of:=CONCATENATE([$LargeDataSets.P1]; " %") -> AsTech Consulting % | R2: of:=CONCATENATE([$LargeDataSets.P1]; " #") -> AsTech Consulting # | S2: of:=CONCATENATE([$LargeDataSets.R1]; " %") -> Contrast Security % | T2: of:=CONCATENATE([$LargeDataSets.R1]; " #") -> Contrast Security # | U2: of:=CONCATENATE([$LargeDataSets.T1]; " %") -> Minded Security % | V2: of:=CONCATENATE([$LargeDataSets.T1]; " #") -> Minded Security # | W2: of:=CONCATENATE([$LargeDataSets.V1]; " %") -> Aspect Security % | X2: of:=CONCATENATE([$LargeDataSets.V1]; " #") -> Aspect Security # | Y2: of:=CONCATENATE([$LargeDataSets.X1]; " %") -> Softtek % | Z2: of:=CONCATENATE([$LargeDataSets.X1]; " #") -> Softtek # | AA2: 2017 Data Prevalence | AB2: 2013 Data Prevalence
A3: A1-Injection | B3: 77,89,564,611,917 | C3: 9 | D3: of:=([.E3]+[.G3]+[.I3]+[.K3]+[.M3]+[.O3]+[.Q3]+[.S3]+[.U3]+[.W3]+[.Y3])/11 -> 0.0529267355155976 | E3: of:=[.F3]/[.F$22] -> 0.0175142435112893 | F3: of:=[$LargeDataSets.D17]+[$LargeDataSets.D15]+[$LargeDataSets.D16]+[$LargeDataSets.D35]+[$LargeDataSets.D38] -> 83 | G3: of:=[.H3]/[.H$22] -> 0.102361975867064 | H3: of:=[$LargeDataSets.F17]+[$LargeDataSets.F15]+[$LargeDataSets.F16]+[$LargeDataSets.F35]+[$LargeDataSets.F38] -> 225398 | I3: of:=[.J3]/[.J$22] -> 0.00596529284164859 | J3: of:=[$LargeDataSets.H17]+[$LargeDataSets.H15]+[$LargeDataSets.H16]+[$LargeDataSets.H35]+[$LargeDataSets.H38] -> 11 | K3: of:=[.L3]/[.L$22] -> 0.0849790544584081 | L3: of:=[$LargeDataSets.J17]+[$LargeDataSets.J15]+[$LargeDataSets.J16]+[$LargeDataSets.J35]+[$LargeDataSets.J38] -> 994 | M3: of:=[.N3]/[.N$22] -> 0.0691299165673421 | N3: of:=[$LargeDataSets.L17]+[$LargeDataSets.L15]+[$LargeDataSets.L16]+[$LargeDataSets.L35]+[$LargeDataSets.L38] -> 58 | O3: of:=[.P3]/[.P$22] -> 0.0157342657342657 | P3: of:=[$LargeDataSets.N17]+[$LargeDataSets.N15]+[$LargeDataSets.N16]+[$LargeDataSets.N35]+[$LargeDataSets.N38] -> 18 | Q3: of:=[.R3]/[.R$22] -> 0.0324720670391061 | R3: of:=[$LargeDataSets.P17]+[$LargeDataSets.P15]+[$LargeDataSets.P16]+[$LargeDataSets.P35]+[$LargeDataSets.P38] -> 372 | S3: of:=[.T3]/[.T$22] -> 0.132868765004001 | T3: of:=[$LargeDataSets.R17]+[$LargeDataSets.R15]+[$LargeDataSets.R16]+[$LargeDataSets.R35]+[$LargeDataSets.R38] -> 7970 | U3: of:=[.V3]/[.V$22] -> 0.0329176334106728 | V3: of:=[$LargeDataSets.T17]+[$LargeDataSets.T15]+[$LargeDataSets.T16]+[$LargeDataSets.T35]+[$LargeDataSets.T38] -> 227 | W3: of:=[.X3]/[.X$22] -> 0.0725016329196604 | X3: of:=[$LargeDataSets.V17]+[$LargeDataSets.V15]+[$LargeDataSets.V16]+[$LargeDataSets.V35]+[$LargeDataSets.V38] -> 111 | Y3: of:=[.Z3]/[.Z$22] -> 0.0157492433181142 | Z3: of:=[$LargeDataSets.X17]+[$LargeDataSets.X15]+[$LargeDataSets.X16]+[$LargeDataSets.X35]+[$LargeDataSets.X38] -> 307 | AA3: of:=[.D3] -> 0.0529267355155976 | AB3: 0.0387854734840415
A4: A2-Broken Authentication and Session Management | B4: 287384 | C4: 4 | D4: of:=([.E4]+[.G4]+[.I4]+[.K4]+[.M4]+[.O4]+[.Q4]+[.S4]+[.U4]+[.W4]+[.Y4])/11 -> 0.0925703989159229 | E4: of:=[.F4]/[.F$22] -> 0.00865161426461279 | F4: of:=[$LargeDataSets.D18]+[$LargeDataSets.D19] -> 41 | G4: of:=[.H4]/[.H$22] -> 0.00136377879807627 | H4: of:=[$LargeDataSets.F18]+[$LargeDataSets.F19] -> 3003 | I4: of:=[.J4]/[.J$22] -> 0.108459869848156 | J4: of:=[$LargeDataSets.H18]+[$LargeDataSets.H19] -> 200 | K4: of:=[.L4]/[.L$22] -> 0.100880567666923 | L4: of:=[$LargeDataSets.J18]+[$LargeDataSets.J19] -> 1180 | M4: of:=[.N4]/[.N$22] -> 0.0846245530393325 | N4: of:=[$LargeDataSets.L18]+[$LargeDataSets.L19] -> 71 | O4: of:=[.P4]/[.P$22] -> 0.097027972027972 | P4: of:=[$LargeDataSets.N18]+[$LargeDataSets.N19] -> 111 | Q4: of:=[.R4]/[.R$22] -> 0.0389315642458101 | R4: of:=[$LargeDataSets.P18]+[$LargeDataSets.P19] -> 446 | S4: of:=[.T4]/[.T$22] -> 0.0625833555614831 | T4: of:=[$LargeDataSets.R18]+[$LargeDataSets.R19] -> 3754 | U4: of:=[.V4]/[.V$22] -> 0.0307424593967517 | V4: of:=[$LargeDataSets.T18]+[$LargeDataSets.T19] -> 212 | W4: of:=[.X4]/[.X$22] -> 0.26518615284128 | X4: of:=[$LargeDataSets.V18]+[$LargeDataSets.V19] -> 406 | Y4: of:=[.Z4]/[.Z$22] -> 0.219822500384753 | Z4: of:=[$LargeDataSets.X18]+[$LargeDataSets.X19] -> 4285 | AA4: of:=[.D4] -> 0.0925703989159229 | AB4: 0.104310835234674
A5: A3-Cross-Site Scripting (XSS) | B5: 79,DOM XSS(no cwe) | C5: 1 | D5: of:=([.E5]+[.G5]+[.I5]+[.K5]+[.M5]+[.O5]+[.Q5]+[.S5]+[.U5]+[.W5]+[.Y5])/11 -> 0.240009818094035 | E5: of:=[.F5]/[.F$22] -> 0.231905465288035 | F5: of:=[$LargeDataSets.D20]+[$LargeDataSets.D21] -> 1099 | G5: of:=[.H5]/[.H$22] -> 0.864372357479893 | H5: of:=[$LargeDataSets.F20]+[$LargeDataSets.F21] -> 1903322 | I5: of:=[.J5]/[.J$22] -> 0.379609544468547 | J5: of:=[$LargeDataSets.H20]+[$LargeDataSets.H21] -> 700 | K5: of:=[.L5]/[.L$22] -> 0.0901940668547491 | L5: of:=[$LargeDataSets.J20]+[$LargeDataSets.J21] -> 1055 | M5: of:=[.N5]/[.N$22] -> 0.268176400476758 | N5: of:=[$LargeDataSets.L20]+[$LargeDataSets.L21] -> 225 | O5: of:=[.P5]/[.P$22] -> 0.0428321678321678 | P5: of:=[$LargeDataSets.N20]+[$LargeDataSets.N21] -> 49 | Q5: of:=[.R5]/[.R$22] -> 0.175628491620112 | R5: of:=[$LargeDataSets.P20]+[$LargeDataSets.P21] -> 2012 | S5: of:=[.T5]/[.T$22] -> 0.230928247532675 | T5: of:=[$LargeDataSets.R20]+[$LargeDataSets.R21] -> 13852 | U5: of:=[.V5]/[.V$22] -> 0.170823665893271 | V5: of:=[$LargeDataSets.T20]+[$LargeDataSets.T21] -> 1178 | W5: of:=[.X5]/[.X$22] -> 0.0960156760287394 | X5: of:=[$LargeDataSets.V20]+[$LargeDataSets.V21] -> 147 | Y5: of:=[.Z5]/[.Z$22] -> 0.0896219155594316 | Z5: of:=[$LargeDataSets.X20]+[$LargeDataSets.X21] -> 1747 | AA5: of:=[.D5] -> 0.240009818094035 | AB5: 0.352599985293076
A6: A4-Insecure Direct Object References | B6: 22639 | C6: 8 | D6: of:=([.E6]+[.G6]+[.I6]+[.K6]+[.M6]+[.O6]+[.Q6]+[.S6]+[.U6]+[.W6]+[.Y6])/11 -> 0.0578732894467373 | E6: of:=[.F6]/[.F$22] -> 0.0187803334036717 | F6: of:=[$LargeDataSets.D23]+[$LargeDataSets.D22] -> 89 | G6: of:=[.H6]/[.H$22] -> 0.00393874575947901 | H6: of:=[$LargeDataSets.F23]+[$LargeDataSets.F22] -> 8673 | I6: of:=[.J6]/[.J$22] -> 0.0151843817787419 | J6: of:=[$LargeDataSets.H23]+[$LargeDataSets.H22] -> 28 | K6: of:=[.L6]/[.L$22] -> 0.056424724288279 | L6: of:=[$LargeDataSets.J23]+[$LargeDataSets.J22] -> 660 | M6: of:=[.N6]/[.N$22] -> 0.147794994040524 | N6: of:=[$LargeDataSets.L23]+[$LargeDataSets.L22] -> 124 | O6: of:=[.P6]/[.P$22] -> 0.0297202797202797 | P6: of:=[$LargeDataSets.N23]+[$LargeDataSets.N22] -> 34 | Q6: of:=[.R6]/[.R$22] -> 0.0152758379888268 | R6: of:=[$LargeDataSets.P23]+[$LargeDataSets.P22] -> 175 | S6: of:=[.T6]/[.T$22] -> 0.103294211789811 | T6: of:=[$LargeDataSets.R23]+[$LargeDataSets.R22] -> 6196 | U6: of:=[.V6]/[.V$22] -> 0.0504640371229698 | V6: of:=[$LargeDataSets.T23]+[$LargeDataSets.T22] -> 348 | W6: of:=[.X6]/[.X$22] -> 0.189418680600914 | X6: of:=[$LargeDataSets.V23]+[$LargeDataSets.V22] -> 290 | Y6: of:=[.Z6]/[.Z$22] -> 0.00630995742061253 | Z6: of:=[$LargeDataSets.X23]+[$LargeDataSets.X22] -> 123 | AA6: of:=[.D6] -> 0.0578732894467373 | AB6: 0.0644486666293322
A7: A5-Security Misconfiguration | B7: 2 | C7: 5 | D7: of:=([.E7]+[.G7]+[.I7]+[.K7]+[.M7]+[.O7]+[.Q7]+[.S7]+[.U7]+[.W7]+[.Y7])/11 -> 0.0858872153078711 | E7: of:=[.F7]/[.F$22] -> 0.0882042625026377 | F7: of:=[$LargeDataSets.D25] -> 418 | G7: of:=[.H7]/[.H$22] -> 0 | H7: of:=[$LargeDataSets.F25] -> 0 | I7: of:=[.J7]/[.J$22] -> 0.00759219088937093 | J7: of:=[$LargeDataSets.H25] -> 14 | K7: of:=[.L7]/[.L$22] -> 0.034196802598957 | L7: of:=[$LargeDataSets.J25] -> 400 | M7: of:=[.N7]/[.N$22] -> 0 | N7: of:=[$LargeDataSets.L25] -> 0 | O7: of:=[.P7]/[.P$22] -> 0.0865384615384615 | P7: of:=[$LargeDataSets.N25] -> 99 | Q7: of:=[.R7]/[.R$22] -> 0.0366620111731844 | R7: of:=[$LargeDataSets.P25] -> 420 | S7: of:=[.T7]/[.T$22] -> 0.157592024539877 | T7: of:=[$LargeDataSets.R25] -> 9453 | U7: of:=[.V7]/[.V$22] -> 0.146461716937355 | V7: of:=[$LargeDataSets.T25] -> 1010 | W7: of:=[.X7]/[.X$22] -> 0.0176355323318093 | X7: of:=[$LargeDataSets.V25] -> 27 | Y7: of:=[.Z7]/[.Z$22] -> 0.369876365874929 | Z7: of:=[$LargeDataSets.X25] -> 7210 | AA7: of:=[.D7] -> 0.0858872153078711 | AB7: 0.116468482846915
A8: A6-Sensitive Data Exposure | B8: 310,312,319,326,327 | C8: 2 | D8: of:=([.E8]+[.G8]+[.I8]+[.K8]+[.M8]+[.O8]+[.Q8]+[.S8]+[.U8]+[.W8]+[.Y8])/11 -> 0.109930140583058 | E8: of:=[.F8]/[.F$22] -> 0.162270521207006 | F8: of:=[$LargeDataSets.D28]+[$LargeDataSets.D27]+[$LargeDataSets.D26] -> 769 | G8: of:=[.H8]/[.H$22] -> 0.0000513176837104956 | H8: of:=[$LargeDataSets.F28]+[$LargeDataSets.F27]+[$LargeDataSets.F26] -> 113 | I8: of:=[.J8]/[.J$22] -> 0.136117136659436 | J8: of:=[$LargeDataSets.H28]+[$LargeDataSets.H27]+[$LargeDataSets.H26] -> 251 | K8: of:=[.L8]/[.L$22] -> 0.104727707959306 | L8: of:=[$LargeDataSets.J28]+[$LargeDataSets.J27]+[$LargeDataSets.J26] -> 1225 | M8: of:=[.N8]/[.N$22] -> 0.0500595947556615 | N8: of:=[$LargeDataSets.L28]+[$LargeDataSets.L27]+[$LargeDataSets.L26] -> 42 | O8: of:=[.P8]/[.P$22] -> 0.198426573426573 | P8: of:=[$LargeDataSets.N28]+[$LargeDataSets.N27]+[$LargeDataSets.N26] -> 227 | Q8: of:=[.R8]/[.R$22] -> 0.0502793296089386 | R8: of:=[$LargeDataSets.P28]+[$LargeDataSets.P27]+[$LargeDataSets.P26] -> 576 | S8: of:=[.T8]/[.T$22] -> 0.144921979194452 | T8: of:=[$LargeDataSets.R28]+[$LargeDataSets.R27]+[$LargeDataSets.R26] -> 8693 | U8: of:=[.V8]/[.V$22] -> 0.177639211136891 | V8: of:=[$LargeDataSets.T28]+[$LargeDataSets.T27]+[$LargeDataSets.T26] -> 1225 | W8: of:=[.X8]/[.X$22] -> 0.133899412148922 | X8: of:=[$LargeDataSets.V28]+[$LargeDataSets.V27]+[$LargeDataSets.V26] -> 205 | Y8: of:=[.Z8]/[.Z$22] -> 0.05083876263274 | Z8: of:=[$LargeDataSets.X28]+[$LargeDataSets.X27]+[$LargeDataSets.X26] -> 991 | AA8: of:=[.D8] -> 0.109930140583058 | AB8: of:=1.37160507523412%+3.24654099558713% -> 0.0461814607082125
A9: A7-Missing Function Level Access Control | B9: 285, 2 of them | C9: 7 | D9: of:=([.E9]+[.G9]+[.I9]+[.K9]+[.M9]+[.O9]+[.Q9]+[.S9]+[.U9]+[.W9]+[.Y9])/11 -> 0.0676575011154021 | E9: of:=[.F9]/[.F$22] -> 0.00506435956952944 | F9: of:=[$LargeDataSets.D24]+[$LargeDataSets.D29] -> 24 | G9: of:=[.H9]/[.H$22] -> 0 | H9: of:=[$LargeDataSets.F24]+[$LargeDataSets.F29] -> 0 | I9: of:=[.J9]/[.J$22] -> 0.0412147505422994 | J9: of:=[$LargeDataSets.H24]+[$LargeDataSets.H29] -> 76 | K9: of:=[.L9]/[.L$22] -> 0.120030777122339 | L9: of:=[$LargeDataSets.J24]+[$LargeDataSets.J29] -> 1404 | M9: of:=[.N9]/[.N$22] -> 0.0905840286054827 | N9: of:=[$LargeDataSets.L24]+[$LargeDataSets.L29] -> 76 | O9: of:=[.P9]/[.P$22] -> 0.274475524475524 | P9: of:=[$LargeDataSets.N24]+[$LargeDataSets.N29] -> 314 | Q9: of:=[.R9]/[.R$22] -> 0.000523743016759777 | R9: of:=[$LargeDataSets.P24]+[$LargeDataSets.P29] -> 6 | S9: of:=[.T9]/[.T$22] -> 0.0291911176313684 | T9: of:=[$LargeDataSets.R24]+[$LargeDataSets.R29] -> 1751 | U9: of:=[.V9]/[.V$22] -> 0.0145011600928074 | V9: of:=[$LargeDataSets.T24]+[$LargeDataSets.T29] -> 100 | W9: of:=[.X9]/[.X$22] -> 0.0940561724363161 | X9: of:=[$LargeDataSets.V24]+[$LargeDataSets.V29] -> 144 | Y9: of:=[.Z9]/[.Z$22] -> 0.0745908787769969 | Z9: of:=[$LargeDataSets.X24]+[$LargeDataSets.X29] -> 1454 | AA9: of:=[.D9] -> 0.0676575011154021 | AB9: 0.0135054743907755
A10: A8-Cross Site Request Forgery (CSRF) | B10: 352,918,Clickjack | C10: 6 | D10: of:=([.E10]+[.G10]+[.I10]+[.K10]+[.M10]+[.O10]+[.Q10]+[.S10]+[.U10]+[.W10]+[.Y10])/11 -> 0.0681265538160604 | E10: of:=[.F10]/[.F$22] -> 0.192234648660055 | F10: of:=[$LargeDataSets.D30]+[$LargeDataSets.D36]+[$LargeDataSets.D34] -> 911 | G10: of:=[.H10]/[.H$22] -> 0.0000195279681376222 | H10: of:=[$LargeDataSets.F30]+[$LargeDataSets.F36]+[$LargeDataSets.F34] -> 43 | I10: of:=[.J10]/[.J$22] -> 0.198481561822126 | J10: of:=[$LargeDataSets.H30]+[$LargeDataSets.H36]+[$LargeDataSets.H34] -> 366 | K10: of:=[.L10]/[.L$22] -> 0.114302812687014 | L10: of:=[$LargeDataSets.J30]+[$LargeDataSets.J36]+[$LargeDataSets.J34] -> 1337 | M10: of:=[.N10]/[.N$22] -> 0.0119189511323004 | N10: of:=[$LargeDataSets.L30]+[$LargeDataSets.L36]+[$LargeDataSets.L34] -> 10 | O10: of:=[.P10]/[.P$22] -> 0.0227272727272727 | P10: of:=[$LargeDataSets.N30]+[$LargeDataSets.N36]+[$LargeDataSets.N34] -> 26 | Q10: of:=[.R10]/[.R$22] -> 0.0143156424581006 | R10: of:=[$LargeDataSets.P30]+[$LargeDataSets.P36]+[$LargeDataSets.P34] -> 164 | S10: of:=[.T10]/[.T$22] -> 0.0348759669245132 | T10: of:=[$LargeDataSets.R30]+[$LargeDataSets.R36]+[$LargeDataSets.R34] -> 2092 | U10: of:=[.V10]/[.V$22] -> 0.0926624129930394 | V10: of:=[$LargeDataSets.T30]+[$LargeDataSets.T36]+[$LargeDataSets.T34] -> 639 | W10: of:=[.X10]/[.X$22] -> 0.0398432397126061 | X10: of:=[$LargeDataSets.V30]+[$LargeDataSets.V36]+[$LargeDataSets.V34] -> 61 | Y10: of:=[.Z10]/[.Z$22] -> 0.0280100548914995 | Z10: of:=[$LargeDataSets.X30]+[$LargeDataSets.X36]+[$LargeDataSets.X34] -> 546 | AA10: of:=[.D10] -> 0.0681265538160604 | AB10: 0.033401983965563
A11: A9-Using Components with Known Vulnerabilities | B11: 937 | C11: 11 | D11: of:=([.E11]+[.G11]+[.I11]+[.K11]+[.M11]+[.O11]+[.Q11]+[.S11]+[.U11]+[.W11]+[.Y11])/11 -> 0.0336633770366752 | E11: of:=[.F11]/[.F$22] -> 0.127031019202363 | F11: of:=[$LargeDataSets.D31] -> 602 | G11: of:=[.H11]/[.H$22] -> 0 | H11: of:=[$LargeDataSets.F31] -> 0 | I11: of:=[.J11]/[.J$22] -> 0.0298264642082429 | J11: of:=[$LargeDataSets.H31] -> 55 | K11: of:=[.L11]/[.L$22] -> 0.0034196802598957 | L11: of:=[$LargeDataSets.J31] -> 40 | M11: of:=[.N11]/[.N$22] -> 0.154946364719905 | N11: of:=[$LargeDataSets.L31] -> 130 | O11: of:=[.P11]/[.P$22] -> 0 | P11: of:=[$LargeDataSets.N31] -> 0 | Q11: of:=[.R11]/[.R$22] -> 0 | R11: of:=[$LargeDataSets.P31] -> 0 | S11: of:=[.T11]/[.T$22] -> 0.0404274473192851 | T11: of:=[$LargeDataSets.R31] -> 2425 | U11: of:=[.V11]/[.V$22] -> 0.0146461716937355 | V11: of:=[$LargeDataSets.T31] -> 101 | W11: of:=[.X11]/[.X$22] -> 0 | X11: of:=[$LargeDataSets.V31] -> 0 | Y11: of:=[.Z11]/[.Z$22] -> 0 | Z11: of:=[$LargeDataSets.X31] -> 0 | AA11: of:=[.D11] -> 0.0336633770366752 | AB11: No Data
A12: A10-Unvalidated Redirects and Forwards | B12: 601,Forwards (no cwe) | C12: 14 | D12: of:=([.E12]+[.G12]+[.I12]+[.K12]+[.M12]+[.O12]+[.Q12]+[.S12]+[.U12]+[.W12]+[.Y12])/11 -> 0.0126521668464532 | E12: of:=[.F12]/[.F$22] -> 0.00464232960540198 | F12: of:=[$LargeDataSets.D32]+[$LargeDataSets.D33] -> 22 | G12: of:=[.H12]/[.H$22] -> 0.0256602042716295 | H12: of:=[$LargeDataSets.F32]+[$LargeDataSets.F33] -> 56503 | I12: of:=[.J12]/[.J$22] -> 0.0319956616052061 | J12: of:=[$LargeDataSets.H32]+[$LargeDataSets.H33] -> 59 | K12: of:=[.L12]/[.L$22] -> 0.00837821663674446 | L12: of:=[$LargeDataSets.J32]+[$LargeDataSets.J33] -> 98 | M12: of:=[.N12]/[.N$22] -> 0 | N12: of:=[$LargeDataSets.L32]+[$LargeDataSets.L33] -> 0 | O12: of:=[.P12]/[.P$22] -> 0.00699300699300699 | P12: of:=[$LargeDataSets.N32]+[$LargeDataSets.N33] -> 8 | Q12: of:=[.R12]/[.R$22] -> 0.000523743016759777 | R12: of:=[$LargeDataSets.P32]+[$LargeDataSets.P33] -> 6 | S12: of:=[.T12]/[.T$22] -> 0.0189217124566551 | T12: of:=[$LargeDataSets.R32]+[$LargeDataSets.R33] -> 1135 | U12: of:=[.V12]/[.V$22] -> 0.0249419953596288 | V12: of:=[$LargeDataSets.T32]+[$LargeDataSets.T33] -> 172 | W12: of:=[.X12]/[.X$22] -> 0.00326583932070542 | X12: of:=[$LargeDataSets.V32]+[$LargeDataSets.V33] -> 5 | Y12: of:=[.Z12]/[.Z$22] -> 0.013851126045247 | Z12: of:=[$LargeDataSets.X32]+[$LargeDataSets.X33] -> 270 | AA12: of:=[.D12] -> 0.0126521668464532 | AB12: 0.00499313166421162
A13: Other Areas | D13: of:=([.E13]+[.G13]+[.I13]+[.K13]+[.M13]+[.O13]+[.Q13]+[.S13]+[.U13]+[.W13]+[.Y13])/11 -> 0
A14: Insufficient Antiautomation | B14: 799 | C14: 13 | D14: of:=([.E14]+[.G14]+[.I14]+[.K14]+[.M14]+[.O14]+[.Q14]+[.S14]+[.U14]+[.W14]+[.Y14])/11 -> 0.012974441104079 | E14: of:=[.F14]/[.F$22] -> 0.00485334458746571 | F14: of:=[$LargeDataSets.D41] -> 23 | G14: of:=[.H14]/[.H$22] -> 0 | H14: of:=[$LargeDataSets.F41] -> 0 | I14: of:=[.J14]/[.J$22] -> 0 | J14: of:=[$LargeDataSets.H41] -> 0 | K14: of:=[.L14]/[.L$22] -> 0.0444558433786441 | L14: of:=[$LargeDataSets.J41] -> 520 | M14: of:=[.N14]/[.N$22] -> 0.0166865315852205 | N14: of:=[$LargeDataSets.L41] -> 14 | O14: of:=[.P14]/[.P$22] -> 0.0725524475524476 | P14: of:=[$LargeDataSets.N41] -> 83 | Q14: of:=[.R14]/[.R$22] -> 0.00148393854748603 | R14: of:=[$LargeDataSets.P41] -> 17 | S14: of:=[.T14]/[.T$22] -> 0.00125033342224593 | T14: of:=[$LargeDataSets.R41] -> 75 | U14: of:=[.V14]/[.V$22] -> 0 | V14: of:=[$LargeDataSets.T41] -> 0 | W14: of:=[.X14]/[.X$22] -> 0 | X14: of:=[$LargeDataSets.V41] -> 0 | Y14: of:=[.Z14]/[.Z$22] -> 0.00143641307135895 | Z14: of:=[$LargeDataSets.X41] -> 28 | AA14: of:=[.D14] -> 0.012974441104079
A15: Information Disclosure | B15: 200388 | C15: 3 | D15: of:=([.E15]+[.G15]+[.I15]+[.K15]+[.M15]+[.O15]+[.Q15]+[.S15]+[.U15]+[.W15]+[.Y15])/11 -> 0.0979044237115995 | E15: of:=[.F15]/[.F$22] -> 0.0573960751213336 | F15: of:=[$LargeDataSets.D40]+[$LargeDataSets.D39] -> 272 | G15: of:=[.H15]/[.H$22] -> 0 | H15: of:=[$LargeDataSets.F40]+[$LargeDataSets.F39] -> 0 | I15: of:=[.J15]/[.J$22] -> 0.0309110629067245 | J15: of:=[$LargeDataSets.H40]+[$LargeDataSets.H39] -> 57 | K15: of:=[.L15]/[.L$22] -> 0.136787210395828 | L15: of:=[$LargeDataSets.J40]+[$LargeDataSets.J39] -> 1600 | M15: of:=[.N15]/[.N$22] -> 0.0893921334922527 | N15: of:=[$LargeDataSets.L40]+[$LargeDataSets.L39] -> 75 | O15: of:=[.P15]/[.P$22] -> 0.145979020979021 | P15: of:=[$LargeDataSets.N40]+[$LargeDataSets.N39] -> 167 | Q15: of:=[.R15]/[.R$22] -> 0.217527932960894 | R15: of:=[$LargeDataSets.P40]+[$LargeDataSets.P39] -> 2492 | S15: of:=[.T15]/[.T$22] -> 0.0331755134702587 | T15: of:=[$LargeDataSets.R40]+[$LargeDataSets.R39] -> 1990 | U15: of:=[.V15]/[.V$22] -> 0.211716937354988 | V15: of:=[$LargeDataSets.T40]+[$LargeDataSets.T39] -> 1460 | W15: of:=[.X15]/[.X$22] -> 0.031352057478772 | X15: of:=[$LargeDataSets.V40]+[$LargeDataSets.V39] -> 48 | Y15: of:=[.Z15]/[.Z$22] -> 0.122710716667522 | Z15: of:=[$LargeDataSets.X40]+[$LargeDataSets.X39] -> 2392 | AA15: of:=[.D15] -> 0.0979044237115995 | AB15: 0.0771289508603861
A16: Denial of Service (DoS) | B16: 400 | C16: 12 | D16: of:=([.E16]+[.G16]+[.I16]+[.K16]+[.M16]+[.O16]+[.Q16]+[.S16]+[.U16]+[.W16]+[.Y16])/11 -> 0.0195760785049818 | E16: of:=[.F16]/[.F$22] -> 0.0789196032918337 | F16: of:=[$LargeDataSets.D37] -> 374 | G16: of:=[.H16]/[.H$22] -> 0 | H16: of:=[$LargeDataSets.F37] -> 0 | I16: of:=[.J16]/[.J$22] -> 0.0146420824295011 | J16: of:=[$LargeDataSets.H37] -> 27 | K16: of:=[.L16]/[.L$22] -> 0.068393605197914 | L16: of:=[$LargeDataSets.J37] -> 800 | M16: of:=[.N16]/[.N$22] -> 0 | N16: of:=[$LargeDataSets.L37] -> 0 | O16: of:=[.P16]/[.P$22] -> 0.00174825174825175 | P16: of:=[$LargeDataSets.N37] -> 2 | Q16: of:=[.R16]/[.R$22] -> 0 | R16: of:=[$LargeDataSets.P37] -> 0 | S16: of:=[.T16]/[.T$22] -> 0 | T16: of:=[$LargeDataSets.R37] -> 0 | U16: of:=[.V16]/[.V$22] -> 0.0324825986078886 | V16: of:=[$LargeDataSets.T37] -> 224 | W16: of:=[.X16]/[.X$22] -> 0.0163291966035271 | X16: of:=[$LargeDataSets.V37] -> 25 | Y16: of:=[.Z16]/[.Z$22] -> 0.00282152567588365 | Z16: of:=[$LargeDataSets.X37] -> 55 | AA16: of:=[.D16] -> 0.0195760785049818 | AB16: 0.00510922009848504
A17: Auditing and Logging | B17: 778 | C17: 15 | D17: of:=([.E17]+[.G17]+[.I17]+[.K17]+[.M17]+[.O17]+[.Q17]+[.S17]+[.U17]+[.W17]+[.Y17])/11 -> 0.00785373502456289 | E17: of:=[.F17]/[.F$22] -> 0 | F17: of:=[$LargeDataSets.D42] -> 0 | G17: of:=[.H17]/[.H$22] -> 0 | H17: of:=[$LargeDataSets.F42] -> 0 | I17: of:=[.J17]/[.J$22] -> 0 | J17: of:=[$LargeDataSets.H42] -> 0 | K17: of:=[.L17]/[.L$22] -> 0.0311190903650509 | L17: of:=[$LargeDataSets.J42] -> 364 | M17: of:=[.N17]/[.N$22] -> 0 | N17: of:=[$LargeDataSets.L42] -> 0 | O17: of:=[.P17]/[.P$22] -> 0 | P17: of:=[$LargeDataSets.N42] -> 0 | Q17: of:=[.R17]/[.R$22] -> 0.00619762569832402 | R17: of:=[$LargeDataSets.P42] -> 71 | S17: of:=[.T17]/[.T$22] -> 0.00821885836222993 | T17: of:=[$LargeDataSets.R42] -> 493 | U17: of:=[.V17]/[.V$22] -> 0 | V17: of:=[$LargeDataSets.T42] -> 0 | W17: of:=[.X17]/[.X$22] -> 0.0404964075767472 | X17: of:=[$LargeDataSets.V42] -> 62 | Y17: of:=[.Z17]/[.Z$22] -> 0.000359103267839737 | Z17: of:=[$LargeDataSets.X42] -> 7 | AA17: of:=[.D17] -> 0.00785373502456289 | AB17: 0.00652014112420959
A18: Mass Assignment | B18: 915 | C18: 16 | D18: of:=([.E18]+[.G18]+[.I18]+[.K18]+[.M18]+[.O18]+[.Q18]+[.S18]+[.U18]+[.W18]+[.Y18])/11 -> 0.00158825186688119 | E18: of:=[.F18]/[.F$22] -> 0.00253217978476472 | F18: of:=[$LargeDataSets.D44] -> 12 | G18: of:=[.H18]/[.H$22] -> 0.00223209217200961 | H18: of:=[$LargeDataSets.F44] -> 4915 | I18: of:=[.J18]/[.J$22] -> 0 | J18: of:=[$LargeDataSets.H44] -> 0 | K18: of:=[.L18]/[.L$22] -> 0.00170984012994785 | L18: of:=[$LargeDataSets.J44] -> 20 | M18: of:=[.N18]/[.N$22] -> 0 | N18: of:=[$LargeDataSets.L44] -> 0 | O18: of:=[.P18]/[.P$22] -> 0.00524475524475525 | P18: of:=[$LargeDataSets.N44] -> 6 | Q18: of:=[.R18]/[.R$22] -> 0 | R18: of:=[$LargeDataSets.P44] -> 0 | S18: of:=[.T18]/[.T$22] -> 0.00175046679114431 | T18: of:=[$LargeDataSets.R44] -> 105 | U18: of:=[.V18]/[.V$22] -> 0 | V18: of:=[$LargeDataSets.T44] -> 0 | W18: of:=[.X18]/[.X$22] -> 0 | X18: of:=[$LargeDataSets.V44] -> 0 | Y18: of:=[.Z18]/[.Z$22] -> 0.00400143641307136 | Z18: of:=[$LargeDataSets.X44] -> 78 | AA18: of:=[.D18] -> 0.00158825186688119
A19: Insufficient Input Validation | B19: None | C19: 10 | D19: of:=([.E19]+[.G19]+[.I19]+[.K19]+[.M19]+[.O19]+[.Q19]+[.S19]+[.U19]+[.W19]+[.Y19])/11 -> 0.0372889156932453 | E19: of:=[.F19]/[.F$22] -> 0 | F19: of:=[$LargeDataSets.D45] -> 0 | G19: of:=[.H19]/[.H$22] -> 0 | H19: of:=[$LargeDataSets.F45] -> 0 | I19: of:=[.J19]/[.J$22] -> 0 | J19: of:=[$LargeDataSets.H45] -> 0 | K19: of:=[.L19]/[.L$22] -> 0 | L19: of:=[$LargeDataSets.J45] -> 0 | M19: of:=[.N19]/[.N$22] -> 0 | N19: of:=[$LargeDataSets.L45] -> 0 | O19: of:=[.P19]/[.P$22] -> 0 | P19: of:=[$LargeDataSets.N45] -> 0 | Q19: of:=[.R19]/[.R$22] -> 0.410178072625698 | R19: of:=[$LargeDataSets.P45] -> 4699 | S19: of:=[.T19]/[.T$22] -> 0 | T19: of:=[$LargeDataSets.R45] -> 0 | U19: of:=[.V19]/[.V$22] -> 0 | V19: of:=[$LargeDataSets.T45] -> 0 | W19: of:=[.X19]/[.X$22] -> 0 | X19: of:=[$LargeDataSets.V45] -> 0 | Y19: of:=[.Z19]/[.Z$22] -> 0 | Z19: of:=[$LargeDataSets.X45] -> 0 | AA19: of:=[.D19] -> 0.0372889156932453
A20: Unrestricted Upload of File with Dangerous Type (CWE-434) | B20: 434 | C20: 17 | D20: of:=([.E20]+[.G20]+[.I20]+[.K20]+[.M20]+[.O20]+[.Q20]+[.S20]+[.U20]+[.W20]+[.Y20])/11 -> 0.00151695741683823 | E20: of:=[.F20]/[.F$22] -> 0 | F20: of:=[$LargeDataSets.D46] -> 0 | G20: of:=[.H20]/[.H$22] -> 0 | H20: of:=[$LargeDataSets.F46] -> 0 | I20: of:=[.J20]/[.J$22] -> 0 | J20: of:=[$LargeDataSets.H46] -> 0 | K20: of:=[.L20]/[.L$22] -> 0 | L20: of:=[$LargeDataSets.J46] -> 0 | M20: of:=[.N20]/[.N$22] -> 0.0166865315852205 | N20: of:=[$LargeDataSets.L46] -> 14 | O20: of:=[.P20]/[.P$22] -> 0 | P20: of:=[$LargeDataSets.N46] -> 0 | Q20: of:=[.R20]/[.R$22] -> 0 | R20: of:=[$LargeDataSets.P46] -> 0 | S20: of:=[.T20]/[.T$22] -> 0 | T20: of:=[$LargeDataSets.R46] -> 0 | U20: of:=[.V20]/[.V$22] -> 0 | V20: of:=[$LargeDataSets.T46] -> 0 | W20: of:=[.X20]/[.X$22] -> 0 | X20: of:=[$LargeDataSets.V46] -> 0 | Y20: of:=[.Z20]/[.Z$22] -> 0 | Z20: of:=[$LargeDataSets.X46] -> 0 | AA20: of:=[.D20] -> 0.00151695741683823
A21: Underprotected APIs | B21: All
C22: Total: | D22: of:=SUM([.D3:.D20]) -> 1 | E22: of:=SUM([.E3:.E20]) -> 1 | F22: of:=SUM([.F3:.F20]) -> 4739 | G22: of:=SUM([.G3:.G20]) -> 1 | H22: of:=SUM([.H3:.H20]) -> 2201970 | I22: of:=SUM([.I3:.I20]) -> 1 | J22: of:=SUM([.J3:.J20]) -> 1844 | K22: of:=SUM([.K3:.K20]) -> 1 | L22: of:=SUM([.L3:.L20]) -> 11697 | M22: of:=SUM([.M3:.M20]) -> 1 | N22: of:=SUM([.N3:.N20]) -> 839 | O22: of:=SUM([.O3:.O20]) -> 1 | P22: of:=SUM([.P3:.P20]) -> 1144 | Q22: of:=SUM([.Q3:.Q20]) -> 1 | R22: of:=SUM([.R3:.R20]) -> 11456 | S22: of:=SUM([.S3:.S20]) -> 1 | T22: of:=SUM([.T3:.T20]) -> 59984 | U22: of:=SUM([.U3:.U20]) -> 1 | V22: of:=SUM([.V3:.V20]) -> 6896 | W22: of:=SUM([.W3:.W20]) -> 1 | X22: of:=SUM([.X3:.X20]) -> 1531 | Y22: of:=SUM([.Y3:.Y20]) -> 1 | Z22: of:=SUM([.Z3:.Z20]) -> 19493 | AA22: of:=SUM([.AA3:.AA20]) -> 1 | AB22: of:=SUM([.AB3:.AB20]) -> 0.863453806299883
C23: # of Apps: | F23: of:=[$LargeDataSets.D6] -> 356 | H23: of:=[$LargeDataSets.F6] -> 44627 | J23: of:=[$LargeDataSets.H6] -> 200 | L23: of:=[$LargeDataSets.J6] -> 1400 | N23: of:=[$LargeDataSets.L6] -> 111 | P23: of:=[$LargeDataSets.N6] -> 148 | R23: of:=[$LargeDataSets.P6] -> 54 | T23: of:=[$LargeDataSets.R6] -> 3734 | V23: of:=[$LargeDataSets.T6] -> 110 | X23: of:=[$LargeDataSets.V6] -> 155 | Z23: of:=[$LargeDataSets.X6] -> 2490
C24: Ave Vulns / App: | F24: of:=[.F22]/[.F23] -> 13.311797752809 | H24: of:=[.H22]/[.H23] -> 49.3416541555561 | J24: of:=[.J22]/[.J23] -> 9.22 | L24: of:=[.L22]/[.L23] -> 8.355 | N24: of:=[.N22]/[.N23] -> 7.55855855855856 | P24: of:=[.P22]/[.P23] -> 7.72972972972973 | R24: of:=[.R22]/[.R23] -> 212.148148148148 | T24: of:=[.T22]/[.T23] -> 16.0642742367434 | V24: of:=[.V22]/[.V23] -> 62.6909090909091 | X24: of:=[.X22]/[.X23] -> 9.87741935483871 | Z24: of:=[.Z22]/[.Z23] -> 7.8285140562249

Sheet: SmallDataSets
A1: Name of Company/Organization | B1: TCS | C1: I4 Consulting | D1: ANCAP | E1: Hidden | F1: EVRY | G1: ITsec Security Services bv | H1: Secure Network | I1: Network Test Labs Inc. | J1: hamed naderi | K1: Shape Security | L1: Khallaagh | M1: Purpletalk | N1: Derek Weeks
A2: Company/Organization Web Site | G2: http://www.itsec.nl/ | H2: Secure Network s.r.l. | I2: networktestlabs.com | K2: shapesecurity.com | L2: khallaagh.ir | N2: Sonatype
A3: Point of Contact E-Mail | B3: jaiswal.v@hotmail.com | C3: justincompsci@gmail.com | D3: alberto.daniel.hill@gmail.com | E3: ANELKAOS@gmail.com | F3: Oleksandr.Kazymyrov@evry.com | G3: e.gozeling@itsec.nl | H3: a.volpatto@securenetwork.it | I3: vernon@networktestlabs.com | J3: hamed.naderi@gmail.com | K3: niki@shapesecurity.com | L3: mohammad.mortazavi.z@gmail.com | M3: pkrishnadeepak@gmail.com | N3: derekeweeks@gmail.com
A4: During what year(s) was this data collected? | B4: Both 2014 & 2015 | C4: Both 2014 & 2015 | D4: Both 2014 & 2015 | E4: Both 2014 & 2015 | F4: 2015 | G4: 2015 | H4: Both 2014 & 2015 | I4: Both 2014 & 2015 | J4: Both 2014 & 2015 | K4: Both 2014 & 2015 | L4: 2015 | M4: Both 2014 & 2015 | N4: 2014
A5: If the application vulnerability data you are submitting was extracted from a publicly available report, please provide a link to that report (or reports), and the relevant page number(s) | G5: N/A | I5: No | N5: 2015 State of the Software Supply Chain Report
A6: How many web applications do the submitted results cover? | B6: 6 | C6: 4 | D6: 10 | E6: 12 | F6: 7 | G6: 46 | H6: 31 | I6: 5 | J6: 10 | K6: 5 | L6: 3 | M6: 10 | N6: 1500
A7: What were the primary programming languages the applications you reviewed written in? | B7: Java, .NET, PHP | C7: Java, Python, PHP, Ruby | D7: Java, .NET, PHP | E7: Java, .NET, PHP, Perl/cgi | F7: Java | G7: Java, PHP | H7: Java, .NET, PHP | I7: .NET, PHP, Ruby, Node.js | J7: Java, .NET, Python, PHP, Ruby, Grails, Play, Node.js | K7: Java, .NET | L7: PHP | M7: Java | N7: Java
A8: Please supply the exact percentage of applications per language checked off above: | C8: 2 100% Java, 1 100% PHP, half Python half Ruby | D8: .net 50% 30% PHP 20% JAVA | E8: 50% php, 40% Java, 5% .NET, 5% Perl/cgi | F8: 1 | G8: Not available, but Java is over 2/3rd | K8: 60%, 40% | N8: 1
A9: What were the primary industries these applications supported? | B9: Healthcare | C9: Internet/Social Media | D9: Healthcare, eCommerce, Energy, Government | E9: Financial, Energy, Government | F9: Financial, eCommerce | G9: Financial, eCommerce, Internet/Social Media, Transport/Logistics | H9: Financial, eCommerce | I9: eCommerce, Internet/Social Media, Entertainment (Games/Music/Movies) | J9: Financial, Healthcare, eCommerce, Internet/Social Media, Airline, Energy, Entertainment (Games/Music/Movies), Government | K9: Financial, eCommerce, Airline, Government, Insurance | L9: Entertainment (Games/Music/Movies) | M9: Financial, Healthcare, eCommerce, Internet/Social Media, Entertainment (Games/Music/Movies), mobile apps | N9: Financial, Internet/Social Media, Entertainment (Games/Music/Movies), Government
A10: Where in the world were the application owners primarily? | B10: North America, Europe, AsiaPac, South America | C10: North America | D10: South America | E10: North America, Europe | F10: Europe | G10: Europe | H10: Europe | I10: North America | J10: South America | K10: North America | L10: Middle East | M10: North America, Europe, AsiaPac | N10: North America, Europe, AsiaPac
A11: What type of team did the bulk of this work? | B11: Internal Assessment Team(s) | C11: Internal Assessment Team(s) | D11: Consulting Organization | E11: Internal Assessment Team(s) | F11: Internal Assessment Team(s) | G11: Internal Assessment Team(s) | H11: Consulting Organization | I11: Consulting Organization | J11: Product Vendor/Service Provider (e.g., SaaS) | K11: Product Vendor/Service Provider (e.g., SaaS) | L11: Internal Assessment Team(s) | M11: Consulting Organization | N11: Product Vendor/Service Provider (e.g., SaaS)
A12: What type of analysis tools do they use? | B12: Free/Open Source Static Application Security Testing (SAST) Tools, Commercial Static Application Security Testing (SAST) Tools, Commercial Dynamic Application Security Testing (DAST) Tools | C12: Free/Open Source Static Application Security Testing (SAST) Tools, Free/Open Source Dynamic Application Security Testing (DAST) Tools | D12: Free/Open Source Dynamic Application Security Testing (DAST) Tools | E12: Free/Open Source Static Application Security Testing (SAST) Tools, Free/Open Source Dynamic Application Security Testing (DAST) Tools, Commercial Dynamic Application Security Testing (DAST) Tools, My own tools. | F12: Free/Open Source Dynamic Application Security Testing (DAST) Tools, Free/Open Source Interactive Application Security Testing (IAST) Tools, Commercial DAST/IAST Hybrid Analysis Tools | G12: Free/Open Source Dynamic Application Security Testing (DAST) Tools, Free/Open Source Interactive Application Security Testing (IAST) Tools, Commercial Dynamic Application Security Testing (DAST) Tools, Commercial DAST/IAST Hybrid Analysis Tools | H12: Free/Open Source Static Application Security Testing (SAST) Tools, Free/Open Source Dynamic Application Security Testing (DAST) Tools, Commercial Dynamic Application Security Testing (DAST) Tools | I12: Free/Open Source Static Application Security Testing (SAST) Tools, Free/Open Source Dynamic Application Security Testing (DAST) Tools, Free/Open Source Interactive Application Security Testing (IAST) Tools, Commercial DAST/IAST Hybrid Analysis Tools | J12: Free/Open Source Static Application Security Testing (SAST) Tools | K12: Commercial Interactive Application Security Testing (IAST) Tools | L12: Free/Open Source Dynamic Application Security Testing (DAST) Tools, Free/Open Source Interactive Application Security Testing (IAST) Tools, Commercial Static Application Security Testing (SAST) Tools | M12: Free/Open Source Static Application Security Testing (SAST) Tools, Free/Open Source Dynamic Application Security Testing (DAST) Tools, Free/Open Source Interactive Application Security Testing (IAST) Tools, Commercial Static Application Security Testing (SAST) Tools, Commercial Dynamic Application Security Testing (DAST) Tools, Commercial Interactive Application Security Testing (IAST) Tools, Commercial DAST/IAST Hybrid Analysis Tools | N12: Open Source Binary Analysis; some in AppSec refer to this as SCA - Software Composition Analysis
A13: Which analysis tools do you frequently use? | B13: AppScan, Burp, Fiddler | C13: Among others, yara GDB Radare zap Burp | D13: acunetix, kali suite, zap, fiddle, shodan | E13: ZAP/Burp, CoreImpact, AppScan and python scripts | F13: HPE WebInspec, ZapProxy, Burp Suite, nmap | G13: Nessus, Burp Suite (Pro), SQLmap, Nikto, SSLScan, NMap, Dirbuster, TestSSLserver.jar, TamperData, WebAlyzer, MetaSploit, ZAP, SoapUI | H13: NMap, BurpSuite, Nessus, SQLMap, SSLScan, Metasploit | I13: Rapid 7, Teneable, Nikto, Qualys, Nmap, Curl, Burp Suite | N13: Sonatype's Application Health Check, Sonatype Nexus Lifecycle, Sonatype Nexus Repository Pro
A14: What is your primary assessment methodology? | B14: Automated analysis tool results - with manual false positive analysis/elimination | C14: Combined manual expert code review and penetration testing with only free tools | D14: Manual expert penetration testing (Expected to be tool assisted w/ free DAST tool(s)) | E14: Manual expert penetration testing (Expected to be tool assisted w/ free DAST tool(s)) | F14: Combined manual expert code review and penetration testing with free and commercial tools | G14: Manual expert penetration testing with commercial DAST tool(s) | H14: Manual expert penetration testing with commercial DAST tool(s) | I14: Manual expert penetration testing (Expected to be tool assisted w/ free DAST tool(s)) | J14: Raw (untriaged) output of automated analysis tool results using default rules | K14: Output from manually tailored automated analysis tool(s) - with manual false positive analysis/elimination | L14: Manual expert penetration testing (Expected to be tool assisted w/ free DAST tool(s)) | M14: Output from manually tailored automated analysis tool(s) - with manual false positive analysis/elimination | N14: Raw (untriaged) output of automated analysis tool results using default rules
A15: Number of SQL Injection Vulnerabilities Found (CWE-89)? | B15: 3 | C15: 60 | D15: 0 | E15: 37 | F15: 0 | G15: 8 | H15: 8 | J15: 12 | L15: 2 | M15: 10
A16: Number of Hibernate Injection Vulnerabilities Found (CWE-564)? | B16: 0 | C16: 3 | D16: 0 | F16: 0 | G16: 0 | H16: 0 | J16: 11 | M16: 10
A17: Number of Command Injection Vulnerabilities Found (CWE-77)? | B17: 0 | C17: 20 | D17: 1 | E17: 4 | F17: 0 | G17: 0 | H17: 2 | J17: 11 | M17: 5
A18: Number of Authentication Vulnerabilities Found (CWE-287)? | B18: 1 | C18: 6 | D18: 3 | E18: 7 | F18: 2 | G18: 102 | H18: 22 | J18: 11 | M18: 6
A19: Number of Session Fixation Vulnerabilities Found (CWE-384)? | B19: 0 | C19: 0 | D19: 0 | E19: 2 | F19: 4 | G19: 13 | H19: 1 | J19: 11 | M19: 8
A20: Number of Cross-Site Scripting (XSS) Vulnerabilities Found (CWE-79)? | B20: 5 | C20: 3 | D20: 2 | E20: 78 | F20: 1 | G20: 40 | H20: 25 | J20: 11 | L20: 3 | M20: 9
A21: Number of DOM-Based XSS Vulnerabilities Found (No CWE)? | B21: 2 | C21: 1 | D21: 0 | E21: 2 | F21: 0 | G21: 1 | H21: 2 | J21: 14 | M21: -9
A22: Number of Insecure Direct Object Reference Vulnerabilities Found (CWE-639)? | B22: 1 | C22: 0 | D22: 5 | E22: 2 | F22: 0 | G22: 13 | H22: 12 | J22: 15 | M22: 51
A23: Number of Path Traversal Vulnerabilities Found (CWE-22)? | B23: 0 | C23: 10 | D23: 1 | E23: 15 | F23: 0 | G23: 1 | H23: 2 | J23: 10 | L23: 1 | M23: 0
A24: Number of Missing Authorization Vulnerabilities Found (CWE-285)? | B24: 1 | C24: 3 | D24: 3 | E24: 12 | F24: 0 | G24: 8 | H24: 6 | J24: 19 | M24: -5
A25: Number of Security Misconfiguration Vulnerabilities Found (CWE-2)? | B25: 3 | C25: 3 | D25: 5 | E25: 3 | F25: 30 | G25: 51 | H25: 50 | J25: 22 | L25: 1 | M25: 6
A26: Number of Cleartext Transmission of Sensitive Information Vulnerabilities Found (CWE-319)? | B26: 2 | C26: 0 | D26: 6 | E26: 1 | F26: 3 | G26: 56 | H26: 6 | J26: 22
A27: Number of Cleartext Storage of Sensitive Information Vulnerabilities Found (CWE-312)? | B27: 0 | C27: 1 | D27: 1 | E27: 7 | F27: 0 | G27: 7 | H27: 1 | J27: 45 | L27: 2
A28: Number of Cryptographic Vulnerabilities Found (CWEs-310/326/327/etc)? | B28: 0 | C28: 0 | D28: 1 | E28: 4 | F28: 15 | G28: 8 | H28: 9 | J28: 33
A29: Number of Improper (Function Level) Access Control Vulnerabilities Found (CWE-285)? | B29: 1 | C29: 0 | D29: 3 | E29: 2 | F29: 1 | G29: 36 | H29: 8 | J29: 33
A30: Number of Cross-Site Request Forgery (CSRF) Vulnerabilities Found (CWE-352)? | B30: 0 | D30: 0 | E30: 12 | F30: 3 | G30: 19 | H30: 16 | J30: 33 | L30: 2
A31: Number of Use of Known Libraries Found (No CWE)? | B31: 0 | D31: 0 | E31: 0 | F31: 7 | G31: 8 | H31: 5 | J31: 33 | N31: 30000 | O31: Note: Sonatype's input wasn't 'small' but all in one category, so we didn't roll it into the large data set analysis.
A32: Number of Unchecked Redirect Vulnerabilities Found (CWE-601)? | B32: 0 | C32: 0 | D32: 2 | E32: 12 | F32: 0 | G32: 11 | H32: 4 | J32: 33
A33: Number of Unvalidated Forward Vulnerabilities Found (No CWE)? | B33: 0 | C33: 0 | D33: 1 | E33: 0 | F33: 2 | G33: 0 | H33: 2 | J33: 33
A34: Number of Clickjacking Vulnerabilities Found (No CWE)? | B34: 1 | C34: 0 | D34: 0 | E34: 0 | F34: 7 | G34: 32 | H34: 4 | J34: 33
A35: Number of XML eXternal Entity Injection (XXE) Vulnerabilities Found (CWE-611)? | B35: 0 | D35: 0 | E35: 4 | F35: 0 | G35: 3 | H35: 0 | J35: 33
A36: Number of Server-Side Request Forgery (SSRF) Vulnerabilities Found (CWE-918)? | B36: 0 | C36: 0 | D36: 0 | E36: 0 | F36: 0 | G36: 0 | H36: 1 | J36: 33
A37: Number of Denial of Service (DOS) Vulnerabilities Found (CWE-400)? | B37: 0 | C37: 4 | D37: 0 | E37: 12 | F37: 2 | G37: 3 | H37: 1 | J37: 33 | L37: 1
A38: Number of Expression Language Injection Vulnerabilities Found (CWE-917)? | B38: 0 | C38: 0 | D38: 0 | E38: 37 | F38: 1 | G38: 0 | H38: 0 | J38: 33
A39: Number of Error Handling Vulnerabilities Found (CWE-388)? | B39: 0 | C39: 0 | D39: 7 | E39: 12 | F39: 14 | G39: 23 | H39: 31 | J39: 33
A40: Number of Information Leakage/Disclosure Vulnerabilities Found (CWE-200)? | B40: 0 | C40: 50 | D40: 4 | E40: 37 | F40: 14 | G40: 107 | H40: 16 | J40: 33 | L40: 2
A41: Number of Insufficient Anti-automation Vulnerabilities Found (CWE-799)? | B41: 0 | C41: 0 | D41: 6 | E41: 4 | F41: 0 | G41: 19 | H41: 12 | I41: 3 | J41: 33 | K41: 5 | L41: 0
A42: Number of Insufficient Security Logging Vulnerabilities Found (CWE-778)? | B42: 0 | C42: 0 | D42: 8 | E42: 12 | F42: 0 | G42: 0 | H42: 0 | J42: 34 | L42: 0
A43: Number of Insufficient Intrusion Detection and Response Vulnerabilities Found (No CWE)? | B43: 0 | C43: 2 | D43: 7 | E43: 12 | F43: 0 | G43: 0 | H43: 0 | J43: 33
A44: Number of Mass Assignment Vulnerabilities Found (CWE-915)? | B44: 0 | D44: 2 | E44: 0 | F44: 0 | G44: 0 | H44: 0 | J44: 33
A45: What other vulnerabilities did you find? | D45: via email | E45: blind sqli and xss everywhere | G45: Inclusion of Web Functionality from an Untrusted Source, CWE-830, 7 Unrestricted Upload of File with Dangerous Type, CWE-434, 5 Improper Input Validation, CWE-20, 4 Use of Insufficiently Random Values, CWE-330, 1 | J45: 33 | K45: Improper Enforcement of a Single, Unique Action (CWE-837): 2 Improper Restriction of Excessive Authentication Attempts (CWE-307): 2
A46: Vulnerability types you think should be added to the T10? | D46: actually i found two cases of injection with code that ran randsomeware, | E46: increase to top 20. HTTP Parameter Pollution | F46: Cryptographic Vulnerabilities, Error Handling Vulnerabilities, Information Leakage | G46: Bad practices and risky behaviours. Though they are not a direct vulnerability, with time-lines getting shorter, unmaintainable code will result in vulnerabilities when updates/additions are made. | I46: Despite being properly defended against the top 10 vulnerabilities, prominent web applications are still vulnerable to Automation. As defined by OWASP, this is a situation in which web applications that are designed for manual use are unable to define, detect, or prevent automated non-whitelisted requests. Applications that are vulnerable include login, account registration, and search forms. To prove this point, we devised an experiment to see if large websites were vulnerable to automation on their login forms. We chose 3 US companies that had many users (as evidenced by their Alexa ratings) and were sizeable ($1B+ revenue) along with 2 other large US companies. We used a simple Selenium test to login to a website with 5 sets of credentials, 4 fake and 1 real. On 3 of the websites we tested, all 5 login attempts were possible, including the real set of credentials. This has real world implications. Our experiment mimics a "credential stuffing" (also known as credential testing or brute force) attack in which an attacker tests a list of stolen credentials from website A on website B. Most won't work, but via automation, the attacker can test an impossibly large number of possible uid/pwd combinations, and then break into the accounts for which the user has reused their credentials. There are many other problems associated with insufficient anti-automation, as detailed in the OWASP Automated Threat Handbook: https://www.owasp.org/images/3/33/Automated-threat-handbook.pdf This data was found on websites managed by some of the top companies in the world, so we can assume their web applications are properly guarded against the OWASP Top 10 vulnerabilities. And yet, their login applications were completely susceptible to automation. Thus, it follows that "insufficient anti-automation" is a significant vulnerability for all web applications. "Insufficient anti-automation (CWE-799)" should be added to OWASP T10. Our research proves that web applications that do not have brute force or automation detection controls in place are at risk of credential stuffing and other automated attacks. This vulnerability is currently rated at a Threat/Severity of High/Medium; however, our test proves how easy it is to exploit and the results can have a dramatic impact on a business and its users. These attacks are easy to scale, (from 1 automated request to 1000 distributed over time), increasing chances of compromise. | J46: 1 | K46: Include "Insufficient Anti-Automation" (longer explanation will be submitted via email)
A47: Vulnerability types you think should be removed from the T10? | D47: none | F47: Missing Function Level Access Control | I47: No comment | J47: 1
A48: Suggested changes to the Top 10 Document/Wiki? | D48: i cant imagine now | I48: The Wiki is easy to use and the T10 PDF is very handy. Please add "Insufficient anti-automation (CWE-799) protection" to the new OWASP T10. Everyone looks to OWASP for guidance and per this research shows a huge potential hole in web app security that IT needs to be aware off. | J48: 1
A49: Suggestions on how to improve this call for data? | C49: Add more fields to comment on why certain vulnerabilities are so high i.e.: one application accesses a database frequently throu multiple pages and so it originally had multiple SQL injection vulnerabilities, some of which are DOS, information disclosure, and authentication bypass | D49: looks good. | E49: Include different codifications of xss attacks. | I49: We are happy with this process, however a downloadable application in the future would be appreciated. | J49: 1 | K49: Allow for attack data to be submitted. We found it limiting to supply just vulnerability data for this particular vulnerability, and that may be the case for other vulnerabilities.

Sheet: NoVulnData
A1: Name of Company/Organization | B1: Easybss | C1: CDAC | D1: EZI | E1: Colegio LaSalle Monteria | F1: Web | G1: DDoS.com | H1: Abfa Mazandaran | I1: SHCP
A2: Company/Organization Web Site | F2: www.web.com | G2: https://www.ddos.com | H2: www.abfa-mazandaran.ir | I2: SHCP
A3: Point of Contact E-Mail | B3: orlando_rodriguezg@hotmail.com | C3: askyadav771@gmail.com | D3: linjie01@sina.com | E3: virustroyano1221@gmail.com | F3: abo.mola0093@gmail.com | G3: lihb@ddos.com | H3: info@abfa-mazandaran.ir | I3: gvillamartelf11@hotmail.com
A4: During what year(s) was this data collected? | B4: Both 2014 & 2015 | C4: Both 2014 & 2015 | D4: Both 2014 & 2015 | E4: Both 2014 & 2015 | F4: Both 2014 & 2015 | G4: 2015 | H4: Both 2014 & 2015 | I4: Both 2014 & 2015
A5: If the application vulnerability data you are submitting was extracted from a publicly available report, please provide a link to that report (or reports), and the relevant page number(s)
A6: How many web applications do the submitted results cover? | B6: 10 | C6: 10 | D6: 10 | E6: 36 | F6: 7 | G6: 1000 | H6: 1 | I6: 23
A7: What were the primary programming languages the applications you reviewed written in? | B7: .NET | C7: Java, .NET, PHP | E7: PHP | F7: Java, .NET, Python, PHP, Ruby, Grails, Play, Node.js | G7: Python, PHP | H7: .NET
A8: Please supply the exact percentage of applications per language checked off above: | E8: 1
A9: What were the primary industries these applications supported? | B9: Financial, eCommerce, Internet/Social Media | C9: Financial, Healthcare, eCommerce | E9: Financial, Internet/Social Media, Educacion | G9: Financial, Healthcare, eCommerce, Entertainment (Games/Music/Movies), Government
A10: Where in the world were the application owners primarily? | B10: North America, South America, Republica Dominicana | E10: North America | G10: North America, AsiaPac
A11: What type of team did the bulk of this work? | B11: Internal Assessment Team(s) | C11: Internal Assessment Team(s) | D11: Internal Assessment Team(s) | E11: pc estudiante | F11: Consulting Organization | G11: Consulting Organization | H11: Product Vendor/Service Provider (e.g., SaaS) | I11: Internal Assessment Team(s)
A12: What type of analysis tools do they use? | B12: Commercial Dynamic Application Security Testing (DAST) Tools, Commercial Interactive Application Security Testing (IAST) Tools, Commercial DAST/IAST Hybrid Analysis Tools | C12: Free/Open Source Static Application Security Testing (SAST) Tools, Free/Open Source Dynamic Application Security Testing (DAST) Tools, Free/Open Source Interactive Application Security Testing (IAST) Tools | D12: Free/Open Source Interactive Application Security Testing (IAST) Tools, Commercial Static Application Security Testing (SAST) Tools | E12: Free/Open Source Static Application Security Testing (SAST) Tools | F12: Free/Open Source Static Application Security Testing (SAST) Tools, Free/Open Source Dynamic Application Security Testing (DAST) Tools, Free/Open Source Interactive Application Security Testing (IAST) Tools, Commercial Static Application Security Testing (SAST) Tools, Commercial Dynamic Application Security Testing (DAST) Tools, Commercial Interactive Application Security Testing (IAST) Tools, Commercial DAST/IAST Hybrid Analysis Tools | G12: Free/Open Source Static Application Security Testing (SAST) Tools, Free/Open Source Dynamic Application Security Testing (DAST) Tools | H12: Free/Open Source Dynamic Application Security Testing (DAST) Tools | I12: Free/Open Source Interactive Application Security Testing (IAST) Tools, Commercial Static Application Security Testing (SAST) Tools
A13: Which analysis tools do you frequently use? | C13: opensource
A14: What is your primary assessment methodology? | B14: Combined manual expert code review and penetration testing with only commercial tools | C14: Manual expert penetration testing (Expected to be tool assisted w/ free DAST tool(s)) | D14: Raw (untriaged) output of automated analysis tool results using default rules | E14: Raw (untriaged) output of automated analysis tool results using default rules | F14: Raw (untriaged) output of automated analysis tool results using default rules | G14: Output from manually tailored automated analysis tool(s) | H14: Combined manual expert code review and penetration testing with only commercial tools | I14: Manual expert penetration testing with commercial DAST tool(s)
A15: Number of SQL Injection Vulnerabilities Found (CWE-89)?
A16: Number of Hibernate Injection Vulnerabilities Found (CWE-564)?
A17: Number of Command Injection Vulnerabilities Found (CWE-77)?
A18: Number of Authentication Vulnerabilities Found (CWE-287)?
A19: Number of Session Fixation Vulnerabilities Found (CWE-384)?
A20: Number of Cross-Site Scripting (XSS) Vulnerabilities Found (CWE-79)?
A21: Number of DOM-Based XSS Vulnerabilities Found (No CWE)?
A22: Number of Insecure Direct Object Reference Vulnerabilities Found (CWE-639)?
A23: Number of Path Traversal Vulnerabilities Found (CWE-22)?
A24: Number of Missing Authorization Vulnerabilities Found (CWE-285)?
A25: Number of Security Misconfiguration Vulnerabilities Found (CWE-2)?
A26: Number of Cleartext Transmission of Sensitive Information Vulnerabilities Found (CWE-319)?
A27: Number of Cleartext Storage of Sensitive Information Vulnerabilities Found (CWE-312)?
A28: Number of Cryptographic Vulnerabilities Found (CWEs-310/326/327/etc)?
A29: Number of Improper (Function Level) Access Control Vulnerabilities Found (CWE-285)?
A30: Number of Cross-Site Request Forgery (CSRF) Vulnerabilities Found (CWE-352)?
A31: Number of Use of Known Libraries Found (No CWE)?
A32: Number of Unchecked Redirect Vulnerabilities Found (CWE-601)?
A33: Number of Unvalidated Forward Vulnerabilities Found (No CWE)?
A34: Number of Clickjacking Vulnerabilities Found (No CWE)?
A35: Number of XML eXternal Entity Injection (XXE) Vulnerabilities Found (CWE-611)?
A36: Number of Server-Side Request Forgery (SSRF) Vulnerabilities Found (CWE-918)?
A37: Number of Denial of Service (DOS) Vulnerabilities Found (CWE-400)?
A38: Number of Expression Language Injection Vulnerabilities Found (CWE-917)?
A39: Number of Error Handling Vulnerabilities Found (CWE-388)?
A40: Number of Information Leakage/Disclosure Vulnerabilities Found (CWE-200)?
A41: Number of Insufficient Anti-automation Vulnerabilities Found (CWE-799)?
A42: Number of Insufficient Security Logging Vulnerabilities Found (CWE-778)?
A43: Number of Insufficient Intrusion Detection and Response Vulnerabilities Found (No CWE)?
A44: Number of Mass Assignment Vulnerabilities Found (CWE-915)?
A45: What other vulnerabilities did you find?
A46: Vulnerability types you think should be added to the T10?
A47: Vulnerability types you think should be removed from the T10?
A48: Suggested changes to the Top 10 Document/Wiki?
A49: Suggestions on how to improve this call for data?