Sheet: Calculations
A2: Edge | B2: OWASP | C2: Acunetix | D2: Frequency score | N2: Settings
A3: Command injection | B3: of:=[$OWASP.D5] -> 15.1600782807901 | C3: of:=[$Acunetix.I2] -> 25.4582168482974 | D3: of:=(IF(ISNUMBER([.B3]);[.B3]*[.$O$3];0)+IF(ISNUMBER([.C3]);[.C3]*[.$O$4];0))/(IF(ISNUMBER([.B3]);[.$O$3];0)+IF(ISNUMBER([.C3]);[.$O$4];0)) -> 18.5927911366259 | N3: OWASP weight | O3: 2
A4: Weak password (login form) | B4: of:=([$OWASP.C6]+[$OWASP.C29])^(1/3)*100 -> 13.2002024869827 | C4: of:=[$Acunetix.I16] -> 19.9163170128991 | D4: of:=(IF(ISNUMBER([.B4]);[.B4]*[.$O$3];0)+IF(ISNUMBER([.C4]);[.C4]*[.$O$4];0))/(IF(ISNUMBER([.B4]);[.$O$3];0)+IF(ISNUMBER([.C4]);[.$O$4];0)) -> 15.4389073289548 | N4: Acunetix weight | O4: 1
A5: Cross Site Request Forgery | B5: of:=[$OWASP.D18] -> 8.28671438173211 | C5: of:=[$Acunetix.I26] -> 77.6061673633012 | D5: of:=(IF(ISNUMBER([.B5]);[.B5]*[.$O$3];0)+IF(ISNUMBER([.C5]);[.C5]*[.$O$4];0))/(IF(ISNUMBER([.B5]);[.$O$3];0)+IF(ISNUMBER([.C5]);[.$O$4];0)) -> 31.3931987089218
A6: Hanging the script (self-inclusion) | B6: X | C6: of:=[$Acunetix.H6] -> 19.9163170128991 | D6: of:=(IF(ISNUMBER([.B6]);[.B6]*[.$O$3];0)+IF(ISNUMBER([.C6]);[.C6]*[.$O$4];0))/(IF(ISNUMBER([.B6]);[.$O$3];0)+IF(ISNUMBER([.C6]);[.$O$4];0)) -> 19.9163170128991
A7: File inclusion (remote PHP script injection) | B7: of:=([$OWASP.C5]/2)^(1/3)*100 -> 12.0325621054233 | C7: of:=([$Acunetix.D2]/2)^(1/3)*100 -> 20.206200103111 | D7: of:=(IF(ISNUMBER([.B7]);[.B7]*[.$O$3];0)+IF(ISNUMBER([.C7]);[.C7]*[.$O$4];0))/(IF(ISNUMBER([.B7]);[.$O$3];0)+IF(ISNUMBER([.C7]);[.$O$4];0)) -> 14.7571081046525
A8: File inclusion (local PHP script injection) | B8: X | C8: of:=[$Acunetix.H6] -> 19.9163170128991 | D8: of:=(IF(ISNUMBER([.B8]);[.B8]*[.$O$3];0)+IF(ISNUMBER([.C8]);[.C8]*[.$O$4];0))/(IF(ISNUMBER([.B8]);[.$O$3];0)+IF(ISNUMBER([.C8]);[.$O$4];0)) -> 19.9163170128991
A9: File inclusion (path traversal) | B9: of:=[$OWASP.D11] -> 17.5208647951791 | C9: of:=[$Acunetix.H7] -> 23.9861030657984 | D9: of:=(IF(ISNUMBER([.B9]);[.B9]*[.$O$3];0)+IF(ISNUMBER([.C9]);[.C9]*[.$O$4];0))/(IF(ISNUMBER([.B9]);[.$O$3];0)+IF(ISNUMBER([.C9]);[.$O$4];0)) -> 19.6759442187189
A10: File upload (PHP script) | B10: of:=[$OWASP.D34] -> 1.82530152626341 | C10: X | D10: of:=(IF(ISNUMBER([.B10]);[.B10]*[.$O$3];0)+IF(ISNUMBER([.C10]);[.C10]*[.$O$4];0))/(IF(ISNUMBER([.B10]);[.$O$3];0)+IF(ISNUMBER([.C10]);[.$O$4];0)) -> 1.82530152626341
A11: Denial of Service | B11: of:=[$OWASP.D25] -> 8.5759217659589 | C11: of:=[$Acunetix.I24] -> 66.2290784774101 | D11: of:=(IF(ISNUMBER([.B11]);[.B11]*[.$O$3];0)+IF(ISNUMBER([.C11]);[.C11]*[.$O$4];0))/(IF(ISNUMBER([.B11]);[.$O$3];0)+IF(ISNUMBER([.C11]);[.$O$4];0)) -> 27.793640669776
A12: SQL injection | B12: of:=[$OWASP.D3] -> 42.9825246851838 | C12: of:=[$Acunetix.I3] -> 64.2800230117402 | D12: of:=(IF(ISNUMBER([.B12]);[.B12]*[.$O$3];0)+IF(ISNUMBER([.C12]);[.C12]*[.$O$4];0))/(IF(ISNUMBER([.B12]);[.$O$3];0)+IF(ISNUMBER([.C12]);[.$O$4];0)) -> 50.0816907940359
A13: Weak session ID | B13: of:=[$OWASP.D7] -> 12.829226679319 | C13: X | D13: of:=(IF(ISNUMBER([.B13]);[.B13]*[.$O$3];0)+IF(ISNUMBER([.C13]);[.C13]*[.$O$4];0))/(IF(ISNUMBER([.B13]);[.$O$3];0)+IF(ISNUMBER([.C13]);[.$O$4];0)) -> 12.829226679319
A14: DOM Cross Site Scripting | B14: of:=[$OWASP.D9] -> 4.54405091366183 | C14: of:=[$Acunetix.H9] -> 17.4351340126513 | D14: of:=(IF(ISNUMBER([.B14]);[.B14]*[.$O$3];0)+IF(ISNUMBER([.C14]);[.C14]*[.$O$4];0))/(IF(ISNUMBER([.B14]);[.$O$3];0)+IF(ISNUMBER([.C14]);[.$O$4];0)) -> 8.84107861332498
A15: Non-DOM Cross Site Scripting | B15: of:=[$OWASP.D8] -> 94.1853899152422 | C15: of:=[$Acunetix.H10] -> 66.2974028846768 | D15: of:=(IF(ISNUMBER([.B15]);[.B15]*[.$O$3];0)+IF(ISNUMBER([.C15]);[.C15]*[.$O$4];0))/(IF(ISNUMBER([.B15]);[.$O$3];0)+IF(ISNUMBER([.C15]);[.$O$4];0)) -> 84.8893942383871
A16: Password sniffing | B16: of:=([$OWASP.C14]+[$OWASP.C15])^(1/3)*100 -> 11.6435902217168 | C16: X | D16: of:=(IF(ISNUMBER([.B16]);[.B16]*[.$O$3];0)+IF(ISNUMBER([.C16]);[.C16]*[.$O$4];0))/(IF(ISNUMBER([.B16]);[.$O$3];0)+IF(ISNUMBER([.C16]);[.$O$4];0)) -> 11.6435902217168
A17: Web Server Vulnerabilities & Misconfigurations | B17: of:=[$OWASP.D13] -> 17.2618788965383 | C17: of:=[$Acunetix.I33] -> 75.3905552832988 | D17: of:=(IF(ISNUMBER([.B17]);[.B17]*[.$O$3];0)+IF(ISNUMBER([.C17]);[.C17]*[.$O$4];0))/(IF(ISNUMBER([.B17]);[.$O$3];0)+IF(ISNUMBER([.C17]);[.$O$4];0)) -> 36.6381043587918
A18: SSL vulnerabilities | B18: of:=[$OWASP.D16] -> 16.1471696003414 | C18: of:=[$Acunetix.I29] -> 55.3965825675447 | D18: of:=(IF(ISNUMBER([.B18]);[.B18]*[.$O$3];0)+IF(ISNUMBER([.C18]);[.C18]*[.$O$4];0))/(IF(ISNUMBER([.B18]);[.$O$3];0)+IF(ISNUMBER([.C18]);[.$O$4];0)) -> 29.2303072560758
A19: Missing/invalid access control | B19: of:=([$OWASP.C12]+[$OWASP.C17])^(1/3)*100 -> 11.915924944963 | C19: X | D19: of:=(IF(ISNUMBER([.B19]);[.B19]*[.$O$3];0)+IF(ISNUMBER([.C19]);[.C19]*[.$O$4];0))/(IF(ISNUMBER([.B19]);[.$O$3];0)+IF(ISNUMBER([.C19]);[.$O$4];0)) -> 11.915924944963
A20: Vulnerable library | B20: of:=[$OWASP.D19] -> 11.3353897219279 | C20: of:=[$Acunetix.I11] -> 68.8590555678771 | D20: of:=(IF(ISNUMBER([.B20]);[.B20]*[.$O$3];0)+IF(ISNUMBER([.C20]);[.C20]*[.$O$4];0))/(IF(ISNUMBER([.B20]);[.$O$3];0)+IF(ISNUMBER([.C20]);[.$O$4];0)) -> 30.509945003911
A21: Server Side Request Forgery | B21: of:=[$OWASP.D24] -> 4.39174189867356 | C21: of:=[$Acunetix.I18] -> 19.1293118277239 | D21: of:=(IF(ISNUMBER([.B21]);[.B21]*[.$O$3];0)+IF(ISNUMBER([.C21]);[.C21]*[.$O$4];0))/(IF(ISNUMBER([.B21]);[.$O$3];0)+IF(ISNUMBER([.C21]);[.$O$4];0)) -> 9.304265208357
A22: Unvalidated redirect / forward | B22: of:=([$OWASP.C20]+[$OWASP.C21])^(1/3)*100 -> 29.3171153486115 | C22: X | D22: of:=(IF(ISNUMBER([.B22]);[.B22]*[.$O$3];0)+IF(ISNUMBER([.C22]);[.C22]*[.$O$4];0))/(IF(ISNUMBER([.B22]);[.$O$3];0)+IF(ISNUMBER([.C22]);[.$O$4];0)) -> 29.3171153486115
A23: Network vulnerability | B23: X | C23: of:=[$Acunetix.I20] -> 65.9364759667164 | D23: of:=(IF(ISNUMBER([.B23]);[.B23]*[.$O$3];0)+IF(ISNUMBER([.C23]);[.C23]*[.$O$4];0))/(IF(ISNUMBER([.B23]);[.$O$3];0)+IF(ISNUMBER([.C23]);[.$O$4];0)) -> 65.9364759667164
A24: Information leakage | B24: of:=[$OWASP.D28] -> 12.1302751526528 | C24: of:=[$Acunetix.I17] -> 34.0564230384454 | D24: of:=(IF(ISNUMBER([.B24]);[.B24]*[.$O$3];0)+IF(ISNUMBER([.C24]);[.C24]*[.$O$4];0))/(IF(ISNUMBER([.B24]);[.$O$3];0)+IF(ISNUMBER([.C24]);[.$O$4];0)) -> 19.4389911145837
A25: Authentication vulnerability | B25: of:=[$OWASP.D6] -> 12.561517121764 | C25: X | D25: of:=(IF(ISNUMBER([.B25]);[.B25]*[.$O$3];0)+IF(ISNUMBER([.C25]);[.C25]*[.$O$4];0))/(IF(ISNUMBER([.B25]);[.$O$3];0)+IF(ISNUMBER([.C25]);[.$O$4];0)) -> 12.561517121764

Sheet: OWASP
B1: Frequency
A2: Vulnerability type | B2: Instances | C2: % of vulns | D2: Score | E2: Detectability | F2: 2017 rank | G2: 2013 rank | H2: # edges
A3: SQL Injection Vulnerabilities (CWE-89) | B3: 182810 | C3: of:=[.B3]/[.$B$36] -> 0.0794101038182529 | D3: of:=[.C3]^(1/3)*100 -> 42.9825246851838 | E3: 3 | F3: 1 | G3: 1 | H3: of:=COUNTIF([$Calculations.$B$3:$Calculations.$B$20]; [.D3]) -> 1 | J3: Out of case study scope
A4: Hibernate Injection Vulnerabilities (CWE-564) | B4: 2068 | C4: of:=[.B4]/[.$B$36] -> 0.000898310238477911 | D4: of:=[.C4]^(1/3)*100 -> 9.64884766494825 | H4: -
A5: Command Injection Vulnerabilities (CWE-77) | B5: 8021 | C5: of:=[.B5]/[.$B$36] -> 0.00348421006906737 | D5: of:=[.C5]^(1/3)*100 -> 15.1600782807901 | E5: 3 | F5: 1 | G5: 1 | H5: of:=COUNTIF([$Calculations.$B$3:$Calculations.$B$20]; [.D5]) -> 1
A6: Authentication Vulnerabilities (CWE-287) | B6: 4563 | C6: of:=[.B6]/[.$B$36] -> 0.00198210329698971 | D6: of:=[.C6]^(1/3)*100 -> 12.561517121764 | E6: 2 | F6: 2 | G6: 2 | H6: of:=COUNTIF([$Calculations.$B$3:$Calculations.$B$25]; [.D6]) -> 1
A7: Session Fixation Vulnerabilities (CWE-384) | B7: 4861 | C7: of:=[.B7]/[.$B$36] -> 0.00211155032361757 | D7: of:=[.C7]^(1/3)*100 -> 12.829226679319 | E7: 2 | F7: 2 | G7: 2 | H7: of:=COUNTIF([$Calculations.$B$3:$Calculations.$B$20]; [.D7]) -> 1
A8: Cross-Site Scripting (XSS) Vulnerabilities (CWE-79) | B8: 1923423 | C8: of:=[.B8]/[.$B$36] -> 0.835508014421615 | D8: of:=[.C8]^(1/3)*100 -> 94.1853899152422 | E8: 3 | F8: 7 | G8: 3 | H8: of:=COUNTIF([$Calculations.$B$3:$Calculations.$B$20]; [.D8]) -> 1
A9: DOM-Based XSS Vulnerabilities (No CWE) | B9: 216 | C9: of:=[.B9]/[.$B$36] -> 0.0000938273750054298 | D9: of:=[.C9]^(1/3)*100 -> 4.54405091366183 | E9: 3 | F9: 7 | G9: 3 | H9: of:=COUNTIF([$Calculations.$B$3:$Calculations.$B$20]; [.D9]) -> 1 | J9: Too broad
A10: Insecure Direct Object Reference Vulnerabilities (CWE-639) | B10: 4235 | C10: of:=[.B10]/[.$B$36] -> 0.00183962469049998 | D10: of:=[.C10]^(1/3)*100 -> 12.253018144017 | H10: -
A11: Path Traversal Vulnerabilities (CWE-22) | B11: 12382 | C11: of:=[.B11]/[.$B$36] -> 0.00537856739498719 | D11: of:=[.C11]^(1/3)*100 -> 17.5208647951791 | E11: 2 | F11: - | G11: - | H11: of:=COUNTIF([$Calculations.$B$3:$Calculations.$B$20]; [.D11]) -> 1
A12: Missing Authorization Vulnerabilities (CWE-285) | B12: 3295 | C12: of:=[.B12]/[.$B$36] -> 0.0014313018548282 | D12: of:=[.C12]^(1/3)*100 -> 11.2696495570556 | E12: 2 | F12: 5 | G12: 7 | H12: 1
A13: Security Misconfiguration Vulnerabilities (CWE-2) | B13: 11841 | C13: of:=[.B13]/[.$B$36] -> 0.00514356457147822 | D13: of:=[.C13]^(1/3)*100 -> 17.2618788965383 | E13: 3 | F13: 6 | G13: 5 | H13: of:=COUNTIF([$Calculations.$B$3:$Calculations.$B$26]; [.D13]) -> 1
A14: Cleartext Transmission of Sensitive Information Vulnerabilities (CWE-319) | B14: 2341 | C14: of:=[.B14]/[.$B$36] -> 0.00101689761522089 | D14: of:=[.C14]^(1/3)*100 -> 10.0560110742913 | E14: 2 | F14: 3 | G14: 6 | H14: 1
A15: Cleartext Storage of Sensitive Information Vulnerabilities (CWE-312) | B15: 1293 | C15: of:=[.B15]/[.$B$36] -> 0.000561661092046392 | D15: of:=[.C15]^(1/3)*100 -> 8.25071235744875 | E15: 2 | F15: 3 | G15: 6 | H15: 1
A16: Cryptographic Vulnerabilities (CWEs-310/326/327/etc) | B16: 9692 | C16: of:=[.B16]/[.$B$36] -> 0.00421006906737327 | D16: of:=[.C16]^(1/3)*100 -> 16.1471696003414 | E16: 2 | F16: 3 | G16: 6 | H16: of:=COUNTIF([$Calculations.$B$3:$Calculations.$B$26]; [.D16]) -> 1
A17: Improper (Function Level) Access Control Vulnerabilities (CWE-285) | B17: 600 | C17: of:=[.B17]/[.$B$36] -> 0.000260631597237305 | D17: of:=[.C17]^(1/3)*100 -> 6.38766828896107 | E17: 2 | F17: 5 | G17: 7 | H17: 1
A18: Cross-Site Request Forgery (CSRF) Vulnerabilities (CWE-352) | B18: 1310 | C18: of:=[.B18]/[.$B$36] -> 0.000569045653968116 | D18: of:=[.C18]^(1/3)*100 -> 8.28671438173211 | E18: 3 | F18: - | G18: 8 | H18: of:=COUNTIF([$Calculations.$B$3:$Calculations.$B$20]; [.D18]) -> 1
A19: Use of Known Libraries (NEW 937) | B19: 3353 | C19: of:=[.B19]/[.$B$36] -> 0.00145649624256114 | D19: of:=[.C19]^(1/3)*100 -> 11.3353897219279 | E19: 2 | F19: 9 | G19: 9 | H19: of:=COUNTIF([$Calculations.$B$3:$Calculations.$B$26]; [.D19]) -> 1
A20: Unchecked Redirect Vulnerabilities (CWE-601) | B20: 57177 | C20: of:=[.B20]/[.$B$36] -> 0.024836888058729 | D20: of:=[.C20]^(1/3)*100 -> 29.176446281852 | E20: 3 | F20: - | G20: 10 | H20: 1
A21: Unvalidated Forward Vulnerabilities (No CWE) | B21: 831 | C21: of:=[.B21]/[.$B$36] -> 0.000360974762173667 | D21: of:=[.C21]^(1/3)*100 -> 7.12020142466126 | E21: 3 | F21: - | G21: 10 | H21: 1 | J21: Out of case study scope
A22: Clickjacking Vulnerabilities (No CWE) | B22: 4144 | C22: of:=[.B22]/[.$B$36] -> 0.00180009556491899 | D22: of:=[.C22]^(1/3)*100 -> 12.1646192633153 | H22: - | J22: Out of scope
A23: XML eXternal Entity Injection (XXE) Vulnerabilities (CWE-611) | B23: 42337 | C23: of:=[.B23]/[.$B$36] -> 0.0183905998870596 | D23: of:=[.C23]^(1/3)*100 -> 26.3956259430763 | H23: -
A24: Server-Side Request Forgery (SSRF) Vulnerabilities (CWE-918) | B24: 195 | C24: of:=[.B24]/[.$B$36] -> 0.0000847052691021242 | D24: of:=[.C24]^(1/3)*100 -> 4.39174189867356 | E24: 2 | F24: - | G24: - | H24: of:=COUNTIF([$Calculations.$B$3:$Calculations.$B$26]; [.D24]) -> 1
A25: Denial of Service (DOS) Vulnerabilities (CWE-400) | B25: 1452 | C25: of:=[.B25]/[.$B$36] -> 0.000630728465314278 | D25: of:=[.C25]^(1/3)*100 -> 8.5759217659589 | E25: 2 | F25: - | G25: - | H25: of:=COUNTIF([$Calculations.$B$3:$Calculations.$B$26]; [.D25]) -> 1 | J25: out of scope (JSP)
A26: Expression Language Injection Vulnerabilities (CWE-917) | B26: 6 | C26: of:=[.B26]/[.$B$36] -> 0.00000260631597237305 | D26: of:=[.C26]^(1/3)*100 -> 1.37618141501543 | H26: - | J26: Out of scope
A27: Error Handling Vulnerabilities (CWE-388) | B27: 4052 | C27: of:=[.B27]/[.$B$36] -> 0.0017601320533426 | D27: of:=[.C27]^(1/3)*100 -> 12.0739234285574 | H27: -
A28: Information Leakage/Disclosure Vulnerabilities (CWE-200) | B28: 4109 | C28: of:=[.B28]/[.$B$36] -> 0.00178489205508014 | D28: of:=[.C28]^(1/3)*100 -> 12.1302751526528 | E28: 2 | F28: 3 | G28: 6 | H28: of:=COUNTIF([$Calculations.$B$3:$Calculations.$B$26]; [.D28]) -> 1
A29: Insufficient Anti-automation Vulnerabilities (CWE-799) | B29: 732 | C29: of:=[.B29]/[.$B$36] -> 0.000317970548629512 | D29: of:=[.C29]^(1/3)*100 -> 6.82541347308411 | E29: 2 | F29: 6 | G29: 5 | H29: 1 | J29: Out of scope
A30: Insufficient Security Logging Vulnerabilities (CWE-778) | B30: 990 | C30: of:=[.B30]/[.$B$36] -> 0.000430042135441553 | D30: of:=[.C30]^(1/3)*100 -> 7.54808884241265 | H30: - | J30: no cases
A31: Insufficient Intrusion Detection and Response Vulnerabilities (No CWE) | B31: 0 | C31: of:=[.B31]/[.$B$36] -> 0 | D31: of:=[.C31]^(1/3)*100 -> 0 | H31: - | J31: out of scope
A32: Mass Assignment Vulnerabilities (CWE-915) | B32: 5058 | C32: of:=[.B32]/[.$B$36] -> 0.00219712436471048 | D32: of:=[.C32]^(1/3)*100 -> 13.0002452906587 | H32: - | J32: out of scope (too broad)
A33: Input Validation | B33: 4699 | C33: of:=[.B33]/[.$B$36] -> 0.00204117979236349 | D33: of:=[.C33]^(1/3)*100 -> 12.6850958571286 | H33: -
A34: Unrestricted Upload of File with Dangerous Type (CWE-434) | B34: 14 | C34: of:=[.B34]/[.$B$36] -> 0.00000608140393553712 | D34: of:=[.C34]^(1/3)*100 -> 1.82530152626341 | E34: 3 | F34: - | G34: - | H34: of:=COUNTIF([$Calculations.$B$3:$Calculations.$B$26]; [.D34]) -> 1
A36: Total: | B36: of:=SUM([.B3:.B34]) -> 2302100

Sheet: Acunetix
A1: Vulnerability category | B1: Subcategory | C1: # in subcat. | D1: % of targets | E1: # in category | F1: % of targets | H1: Subcategory score | I1: Category score | K1: Used?
A2: Remote Code Execution | B2: Remote Code Execution | C2: 165 | D2: of:=[.C2]/10000 -> 0.0165 | E2: 165 | F2: of:=[.E2]/10000 -> 0.0165 | H2: of:=[.D2]^(1/3)*100 -> 25.4582168482974 | I2: of:=[.F2]^(1/3)*100 -> 25.4582168482974 | K2: X
A3: SQL Injection (SQLi) | B3: SQL Injection (SQLi) | C3: 1328 | D3: of:=[.C3]/10000 -> 0.1328 | E3: of:=SUM([.C3:.C5]) -> 2656 | F3: of:=SUM([.D3:.D5]) -> 0.2656 | H3: of:=[.D3]^(1/3)*100 -> 51.0190880746882 | I3: of:=[.F3]^(1/3)*100 -> 64.2800230117402 | K3: X
B4: BLIND SQLI | C4: 776 | D4: of:=[.C4]/10000 -> 0.0776 | H4: of:=[.D4]^(1/3)*100 -> 42.6534247101177 | I4: of:=[.F4]^(1/3)*100 -> 0 | K4: X
B5: UNION/EROR SQLI | C5: 552 | D5: of:=[.C5]/10000 -> 0.0552 | H5: of:=[.D5]^(1/3)*100 -> 38.0755652392661 | I5: of:=[.F5]^(1/3)*100 -> 0 | K5: X
A6: Local File Inclusion & Directory Traversal | B6: Local File Inclusion | C6: 79 | D6: of:=[.C6]/10000 -> 0.0079 | E6: of:=SUM([.C6:.C8]) -> 434 | F6: of:=SUM([.D6:.D8]) -> 0.0434 | H6: of:=[.D6]^(1/3)*100 -> 19.9163170128991 | I6: of:=[.F6]^(1/3)*100 -> 35.142277986987 | K6: X
B7: Directory Traversal | C7: 138 | D7: of:=[.C7]/10000 -> 0.0138 | E7: of:=SUM([.C7:.C9]) -> 408 | H7: of:=[.D7]^(1/3)*100 -> 23.9861030657984 | K7: X
B8: Both | C8: 217 | D8: of:=[.C8]/10000 -> 0.0217 | E8: of:=SUM([.C8:.C10]) -> 3184 | H8: of:=[.D8]^(1/3)*100 -> 27.892444522551 | K8: X
A9: XSS | B9: Dom-Based XSS | C9: 53 | D9: of:=[.C9]/10000 -> 0.0053 | E9: of:=SUM([.C9:.C10]) -> 2967 | F9: of:=SUM([.D9:.D10]) -> 0.2967 | H9: of:=[.D9]^(1/3)*100 -> 17.4351340126513 | I9: of:=[.F9]^(1/3)*100 -> 66.6969307036865 | K9: X
B10: XSS | C10: 2914 | D10: of:=[.C10]/10000 -> 0.2914 | H10: of:=[.D10]^(1/3)*100 -> 66.2974028846768 | K10: X
A11: JS library vulnerabilities | B11: JQUERY | C11: 2407 | D11: of:=[.C11]/10000 -> 0.2407 | E11: of:=SUM([.C11:.C15]) -> 3265 | F11: of:=SUM([.D11:.D15]) -> 0.3265 | H11: of:=[.D11]^(1/3)*100 -> 62.2050098837906 | I11: of:=[.F11]^(1/3)*100 -> 68.8590555678771 | K11: X
B12: JQUERY MIGRATE | C12: 101 | D12: of:=[.C12]/10000 -> 0.0101 | H12: of:=[.D12]^(1/3)*100 -> 21.6159233294508 | K12: X
B13: YUI | C13: 65 | D13: of:=[.C13]/10000 -> 0.0065 | H13: of:=[.D13]^(1/3)*100 -> 18.6625557840862 | K13: X
B14: MOMENT.JS | C14: 72 | D14: of:=[.C14]/10000 -> 0.0072 | H14: of:=[.D14]^(1/3)*100 -> 19.3097876921126 | K14: X
B15: JQUERY UI | C15: 620 | D15: of:=[.C15]/10000 -> 0.062 | H15: of:=[.D15]^(1/3)*100 -> 39.5789160968041 | K15: X
A16: Weak Passwords | B16: Weak Passwords | C16: 79 | D16: of:=[.C16]/10000 -> 0.0079 | E16: 79 | F16: of:=[.E16]/10000 -> 0.0079 | H16: of:=[.D16]^(1/3)*100 -> 19.9163170128991 | I16: of:=[.F16]^(1/3)*100 -> 19.9163170128991 | K16: X
A17: Source Code Disclosure | B17: Source Code Disclosure | C17: 395 | D17: of:=[.C17]/10000 -> 0.0395 | E17: 395 | F17: of:=[.E17]/10000 -> 0.0395 | H17: of:=[.D17]^(1/3)*100 -> 34.0564230384454 | I17: of:=[.F17]^(1/3)*100 -> 34.0564230384454 | K17: X
A18: Server-side Request Forgery | B18: Server-side Request Forgery | C18: 70 | D18: of:=[.C18]/10000 -> 0.007 | E18: 70 | F18: of:=[.E18]/10000 -> 0.007 | H18: of:=[.D18]^(1/3)*100 -> 19.1293118277239 | I18: of:=[.F18]^(1/3)*100 -> 19.1293118277239 | K18: X
A19: Overflow Vulnerabilities | B19: Overflow Vulnerabilities | C19: 475 | D19: of:=[.C19]/10000 -> 0.0475 | E19: 475 | F19: of:=[.E19]/10000 -> 0.0475 | H19: of:=[.D19]^(1/3)*100 -> 36.2157822172087 | I19: of:=[.F19]^(1/3)*100 -> 36.2157822172087 | K19: -
A20: Network Vulnerabilities | B20: SSH-related vulnerabilities | C20: ~1900 | D20: 0.19 | E20: High: ~1600 Medium ~3500 | F20: High: 16% Medium: 35% | H20: of:=[.D20]^(1/3)*100 -> 57.4889707894483 | I20: of:=((0.35*2+0.16)/3)^(1/3)*100 -> 65.9364759667164 | K20: X
B21: FTP-related vulnerabilities | C21: ~600 | D21: 0.06 | H21: of:=[.D21]^(1/3)*100 -> 39.1486764116886 | K21: X
B22: Mail-related vulnerabilities | C22: ~20 | D22: 0.02 | H22: of:=[.D22]^(1/3)*100 -> 27.1441761659491 | K22: X
B23: DNS-related vulnerabilities | C23: ~20 | D23: 0.02 | H23: of:=[.D23]^(1/3)*100 -> 27.1441761659491 | K23: X
A24: DoS | B24: Slow HTTP DoS | C24: 1211 | D24: of:=[.C24]/10000 -> 0.1211 | E24: of:=SUM([.C24:.C25]) -> 2905 | F24: of:=SUM([.D24:.D25]) -> 0.2905 | H24: of:=[.D24]^(1/3)*100 -> 49.4744962658478 | I24: of:=[.F24]^(1/3)*100 -> 66.2290784774101 | K24: X
B25: DoS | C25: 1694 | D25: of:=[.C25]/10000 -> 0.1694 | H25: of:=[.D25]^(1/3)*100 -> 55.3313332932997 | K25: X
A26: Cross-site Request Forgery | B26: Cross-site Request Forgery | C26: 4674 | D26: of:=[.C26]/10000 -> 0.4674 | E26: 4674 | F26: of:=[.E26]/10000 -> 0.4674 | H26: of:=[.D26]^(1/3)*100 -> 77.6061673633012 | I26: of:=[.F26]^(1/3)*100 -> 77.6061673633012 | K26: X
A27: Host Header Injection | B27: Host Header Injection | C27: 396 | D27: of:=[.C27]/10000 -> 0.0396 | E27: 396 | F27: of:=[.E27]/10000 -> 0.0396 | H27: of:=[.D27]^(1/3)*100 -> 34.0851384171747 | I27: of:=[.F27]^(1/3)*100 -> 34.0851384171747 | K27: -
A28: Directory Listing | B28: Directory Listing | C28: 795 | D28: of:=[.C28]/10000 -> 0.0795 | E28: 795 | F28: of:=[.E28]/10000 -> 0.0795 | H28: of:=[.D28]^(1/3)*100 -> 42.9987380195705 | I28: of:=[.F28]^(1/3)*100 -> 42.9987380195705 | K28: -
A29: TLS/SSL Vulnerabilities | B29: BREACH | C29: 595 | D29: of:=[.C29]/10000 -> 0.0595 | E29: ~1700 | F29: 0.17 | H29: of:=[.D29]^(1/3)*100 -> 39.0396266088985 | I29: of:=[.F29]^(1/3)*100 -> 55.3965825675447 | K29: X
B30: DROWN | C30: 57 | D30: of:=[.C30]/10000 -> 0.0057 | H30: of:=[.D30]^(1/3)*100 -> 17.8631598770806 | K30: X
B31: POODLE | C31: 306 | D31: of:=[.C31]/10000 -> 0.0306 | H31: of:=[.D31]^(1/3)*100 -> 31.2781080437653 | K31: X
B32: HEARTBLEED | C32: 2 | D32: of:=[.C32]/10000 -> 0.0002 | H32: of:=[.D32]^(1/3)*100 -> 5.84803547642573 | K32: X
A33: Web Server Vulnerabilities & Misconfigurations | B33: Apache | C33: 749 | D33: of:=[.C33]/10000 -> 0.0749 | E33: of:=SUM([.C33:.C35]) -> 4285 | F33: of:=SUM([.D33:.D35]) -> 0.4285 | H33: of:=[.D33]^(1/3)*100 -> 42.1528819805945 | I33: of:=[.F33]^(1/3)*100 -> 75.3905552832988 | K33: X
B34: IIS | C34: 2097 | D34: of:=[.C34]/10000 -> 0.2097 | H34: of:=[.D34]^(1/3)*100 -> 59.4109016483917 | K34: X
B35: NGINX | C35: 1439 | D35: of:=[.C35]/10000 -> 0.1439 | H35: of:=[.D35]^(1/3)*100 -> 52.4026920125045 | K35: X